,Name,Tweet
1449,Donald Trump,Just another disgruntled former employee who got fired for gross incompetence!
1450,Donald Trump,"Ratings are way down, lost all credibility. Beautiful to watch!"
1451,Donald Trump,"Maria, despite all of their will and energy, it won’t work!"
1452,Donald Trump,Thank you Mike!
1453,Donald Trump,Two incredible people. I can’t believe they’re not working (few work harder)!
1454,Donald Trump,"The Fake and Corrupt Media is sooo bad for our Country, The Enemy of the People!"
1455,Donald Trump,"Congratulations, Great Show!"
1456,Donald Trump,"Thank you Jon, working hard!"
1457,Donald Trump,Nobody ever heard of this dope until he met me. He only lasted 11 days!
1458,Donald Trump,I promise not to do this to Greenland!
1459,Donald Trump,Thank you to my great supporters at the 2019 @IowaStateFair!
1460,Donald Trump,Great discussion with Prime Minister @BorisJohnson today. We talked about Brexit and how we can move rapidly on a U…
1461,Donald Trump,"Spoke to my two good friends, Prime Minister Modi of India, and Prime Minister Khan of Pakistan, regarding Trade, S…"
1462,Donald Trump,THANK YOU! #MAGA
1463,Donald Trump,Massive overflow crowds in New Hampshire last week. Couldn’t get into packed SNHU Arena. Fake and Corrupt News woul…
1464,Donald Trump,"Wow, Report Just Out! Google manipulated from 2.6 million to 16 million votes for Hillary Clinton in 2016 Election!…"
1465,Donald Trump,".....The Fed Rate, over a fairly short period of time, should be reduced by at least 100 basis points, with perhaps…"
1466,Donald Trump,"Our Economy is very strong, despite the horrendous lack of vision by Jay Powell and the Fed, but the Democrats are…"
1467,Donald Trump,"Democrats want Open Borders and Crime! So dangerous for our Country. But we are building a big, beautiful, NEW Wall…"
1468,Donald Trump,....got fired. Wrote a very nice book about me just recently. Now the book is a lie? Said his wife was driving him…
1469,Donald Trump,"Anthony Scaramucci is a highly unstable “nut job” who was with other candidates in the primary who got shellacked,…"
1470,Donald Trump,"Great cohesion inside the Republican Party, the best I have ever seen. Despite all of the Fake News, my Poll Number…"
1471,Donald Trump,"The New York Times will be out of business soon after I leave office, hopefully in 6 years. They have Zero credibil…"
1472,Donald Trump,"Thank you @TedCruz, I couldn’t agree more!"
1473,Donald Trump,House Democrats want to take action against Israel because it is fighting back against two (maybe four) people that…
1474,Donald Trump,"Our economy is the best in the world, by far. Lowest unemployment ever within almost all categories. Poised for big…"
1475,Donald Trump,"Juan Williams at @FoxNews is so pathetic, and yet when he met me in the Fox Building lobby, he couldn’t have been n…"
1476,Donald Trump,"We are doing very well with China, and talking!"
1477,Donald Trump,Doing really well!
1478,Donald Trump,MAKE AMERICA GREAT AGAIN!
1479,Donald Trump,"With all that this Administration has accomplished, think what my Poll Numbers would be if we had an honest Media, which we do not!"
1480,Donald Trump,.....”Journalism” has reached a new low in the history of our Country. It is nothing more than an evil propaganda m…
1481,Donald Trump,"The Failing New York Times, in one of the most devastating portrayals of bad journalism in history, got caught by a…"
1482,Donald Trump,Such a disgrace at the once great @nytimes!
1483,Donald Trump,Thank you!
1484,Donald Trump,The Fake News Media HATES to see this!
1485,Donald Trump,"Thank you to @SaraCarterDC. A great and legitimate reporter, as opposed to those at the Failing New York Times!"
1486,Donald Trump,Major consideration is being given to naming ANTIFA an “ORGANIZATION OF TERROR.” Portland is being watched very clo…
1487,Donald Trump,"Biggest crowd EVER, according to Arena people. Thousands outside trying to get in. Place was packed! Radical Left D…"
1488,Donald Trump,"Look at the tremendous overflow at packed arena in New Hampshire last night. Sorry we couldn’t get you in, will be…"
1489,Donald Trump,"Great time in New Hampshire last night. Placed was maxed out, totally packed, with thousands coming to the arena fl…"
1490,Donald Trump,Having dinner tonight with Tim Cook of Apple. They will be spending vast sums of money in the U.S. Great!
1491,Donald Trump,"Just completed a very good meeting on Afghanistan. Many on the opposite side of this 19 year war, and us, are looki…"
1492,Donald Trump,"I donate 100% of my President’s salary, $400,000, back to our Country, and feel very good about it!"
1493,Donald Trump,"Like it or not, Tlaib and Omar are fast becoming the face of the Democrat Party. Cortez (AOC) is fuming, not happy about this!"
1494,Donald Trump,Rep. Tlaib wrote a letter to Israeli officials desperately wanting to visit her grandmother. Permission was quickly…
1495,Donald Trump,"Israel was very respectful &amp; nice to Rep. Rashida Tlaib, allowing her permission to visit her “grandmother.” As soo…"
1496,Donald Trump,
1497,Donald Trump,
1498,Donald Trump,"Senator Jim Risch of the Great State of Idaho has been an incredible supporter of our Agenda! He is tough on Crime,…"
1499,Donald Trump,Congratulations to Patrick Yoes for his election as National President of the great Fraternal Order of Police. Toge…
1500,Donald Trump,Thank you to my good friend Chuck Canterbury for 16 years of service to the Fraternal Order of Police and our great…
1501,Donald Trump,"A great evening, with incredible people, in New Hampshire!"
1502,Donald Trump,Thank you Rudy!
1503,Donald Trump,"Great news! Tonight, we broke the all-time attendance record previously held by Elton John at #SNHUArena in Manches…"
1504,Donald Trump,Thank you New Hampshire. KEEP AMERICA GREAT! #KAG2020
1505,Donald Trump,
1506,Donald Trump,"Walmart, a great indicator as to how the U.S. is doing, just released outstanding numbers. Our Country, unlike othe…"
1507,Donald Trump,"“If they don’t get this Trade Deal with the U.S. done, China could have it first recession (or worse!) in years. Th…"
1508,Donald Trump,"Sadly, much truth to this!"
1509,Donald Trump,"Andrew, thank you! We will never forgive or forget."
1510,Donald Trump,Biden doesn’t have a clue! I will solve the China problem.
1511,Donald Trump,The Fake News Media is doing everything they can to crash the economy because they think that will be bad for me an…
1512,Donald Trump,"Representatives Omar and Tlaib are the face of the Democrat Party, and they HATE Israel!"
1513,Donald Trump,Wow! The Deputy Editor of the Failing New York Times was just demoted. Should have been Fired! Totally biased and i…
1514,Donald Trump,Our Great Farmers know how important it is to win on Trade. They will be the big winners!
1515,Donald Trump,"The United States is now, by far, the Biggest, Strongest and Most Powerful Economy in the World, it is not even clo…"
1516,Donald Trump,"If President Xi would meet directly and personally with the protesters, there would be a happy and enlightened endi…"
1517,Donald Trump,It would show great weakness if Israel allowed Rep. Omar and Rep.Tlaib to visit. They hate Israel &amp; all Jewish peop…
1518,Donald Trump,The Philadelphia shooter should never have been allowed to be on the streets. He had a long and very dangerous crim…
1519,Donald Trump,"....what they were doing. There’s plenty of indication, we don’t have to speculate.” @SteveDoocy “Holy cow, got to…"
1520,Donald Trump,"Go out and get Andrew McCarthy’s new book, “Ball of Collusion.” “Supervision became the investigator, and when they…"
1521,Donald Trump,"Thank you, and the Wall is under major construction!"
1522,Donald Trump,"Two great entertainers and, more importantly, great people! Check out their show."
1523,Donald Trump,I know President Xi of China very well. He is a great leader who very much has the respect of his people. He is als…
1524,Donald Trump,"..deferral to December. It actually helps China more than us, but will be reciprocated. Millions of jobs are being…"
1525,Donald Trump,Good things were stated on the call with China the other day. They are eating the Tariffs with the devaluation of t…
1526,Donald Trump,Sad!
1527,Donald Trump,"Unlike others, our economy is strong!"
1528,Donald Trump,"..Spread is way too much as other countries say THANK YOU to clueless Jay Powell and the Federal Reserve. Germany,…"
1529,Donald Trump,"We are winning, big time, against China. Companies &amp; jobs are fleeing. Prices to us have not gone up, and in some c…"
1530,Donald Trump,The Great Charles Payne @cvpayne correctly stated that Fed Chair Jay Powell made TWO enormous mistakes. 1. When he…
1531,Donald Trump,Tremendous amounts of money pouring into the United States. People want safety!
1532,Donald Trump,"“So far, you’ve had Tariffs imposed on 300 Billion Dollars worth of Chinese products, but you can’t tell me that it…"
1533,Donald Trump,"“The Fed has got to do something! The Fed is the Central Bank of the United States, not the Central Bank of the Wor…"
1534,Donald Trump,"Join me tomorrow night in Manchester, New Hampshire at 7:00 P.M. Eastern! #KAG2020"
1535,Donald Trump,"A fighter and champion, GREAT!"
1536,Donald Trump,"Great interview of Ron Vitiello, Former Acting Ice Director, by @JesseBWatters, on @FoxNews, about all of the work…"
1537,Donald Trump,"Great day in the incredible Commonwealth of Pennsylvania today, with the amazing energy workers, construction worke…"
1538,Donald Trump,No debate on Election Security should go forward without first agreeing that Voter ID (Identification) must play a…
1539,Donald Trump,Thank you Bill!
1540,Donald Trump,"True! Without being stuck at an airport, where CNN buys (at a big price) an uninterested audience, they’ve got noth…"
1541,Donald Trump,"It always happens! When a Conservative does even a fraction of what Chris Cuomo did with his lunatic ranting, ravin…"
1542,Donald Trump,See you in New Hampshire!
1543,Donald Trump,Just leaving. Incredible Complex. JOBS! JOBS! JOBS!
1544,Donald Trump,So terrible!
1545,Donald Trump,Put it back up. We are living with a Rigged &amp; Fake Media!
1546,Donald Trump,Just landed in Pennsylvania. Looking forward to making a speech on energy. So important!
1547,Donald Trump,Our Intelligence has informed us that the Chinese Government is moving troops to the Border with Hong Kong. Everyon…
1548,Donald Trump,"Many are blaming me, and the United States, for the problems going on in Hong Kong. I can’t imagine why?"
1549,Donald Trump,ALL THE NEWS THAT’S NOT FIT TO PRINT! “The New York Times is no longer the paper we grew up with. It is no longer a…
1550,Donald Trump,"As usual, China said they were going to be buying “big” from our great American Farmers. So far they have not done…"
1551,Donald Trump,Would Chris Cuomo be given a Red Flag for his recent rant? Filthy language and a total loss of control. He shouldn’…
1552,Donald Trump,Thank you Steve!
1553,Donald Trump,"Through massive devaluation of their currency and pumping vast sums of money into their system, the tens of billion…"
1554,Donald Trump,I thought Chris was Fredo also. The truth hurts. Totally lost it! Low ratings @CNN
1555,Donald Trump,"Thank you John, you are a special guy!"
1556,Donald Trump,"Curt Schilling, a great pitcher and patriot, is considering a run for Congress in Arizona. Terrific!  @foxandfriends"
1557,Donald Trump,"The United States is learning much from the failed missile explosion in Russia. We have similar, though more advanc…"
1558,Donald Trump,Two great and loyal friends!
1559,Donald Trump,"Scaramucci, who like so many others had nothing to do with my Election victory, is only upset that I didn’t want hi…"
1560,Donald Trump,Thank you NEGOP!
1561,Donald Trump,Many incredible things are happening right now for our Country. After years of being ripped off by other nations on…
1562,Donald Trump,"..TV talent. Then, during the 2016 Election, I would watch as Joe Scarborough &amp; his very angry Psycho wife(?) would…"
1563,Donald Trump,"So funny to watch Little Donny Deutsch on TV with his own failing show. When I did The Apprentice, Donny would call…"
1564,Donald Trump,.....other than the fact that this Administration has probably done more than any other Administration in its first…
1565,Donald Trump,"Anthony Scaramucci, who was quickly terminated (11 days) from a position that he was totally incapable of handling,…"
1566,Donald Trump,"Joe Biden just said, “We believe in facts, not truth.” Does anybody really believe he is mentally fit to be preside…"
1567,Donald Trump,"Think how wonderful it is to be able to fight back and show, to so many, how totally dishonest the Fake News Media…"
1568,Donald Trump,"China wants to make a deal so badly. Thousands of companies are leaving because of the Tariffs, they must stem the…"
1569,Donald Trump,"....cause big disruption by going to Manhattan. Working almost all of the time, including evenings. Don’t have to b…"
1570,Donald Trump,"Got to see, by accident, wacko comedian Bill Maher’s show - So many lies. He said patients in El Paso hospital didn…"
1571,Donald Trump,"Never has the press been more inaccurate, unfair or corrupt! We are not fighting the Democrats, they are easy, we a…"
1572,Donald Trump,"....also a small apology for testing the short range missiles, and that this testing would stop when the exercises…"
1573,Donald Trump,"In a letter to me sent by Kim Jong Un, he stated, very nicely, that he would like to meet and start negotiations as…"
1574,Donald Trump,Maggie Haberman of the Failing @nytimes reported that I was annoyed by the lack of cameras inside the hospitals in…
1575,Donald Trump,"....to inflame and cause chaos. They create their own violence, and then try to blame others. They are the true Rac…"
1576,Donald Trump,"Liberal Hollywood is Racist at the highest level, and with great Anger and Hate! They like to call themselves “Elit…"
1577,Donald Trump,"....mentally ill or deranged people. I am the biggest Second Amendment person there is, but we all must work togeth…"
1578,Donald Trump,Serious discussions are taking place between House and Senate leadership on meaningful Background Checks. I have a…
1579,Donald Trump,"Rod Blagojevich, the former Governor of Illinois, was sentenced to 14 years in prison. He has served 7 years. Many…"
1580,Donald Trump,"....career in the military, retiring from the U.S. Navy in 2010. He commanded at every level, including the Naval S…"
1581,Donald Trump,"I am pleased to inform you that the Honorable Joseph Maguire, current Director of the National Counterterrorism Cen…"
1582,Donald Trump,....coincides with the retirement of Dan Coats. A new Acting Director of National Intelligence will be named shortly.
1583,Donald Trump,Sue Gordon is a great professional with a long and distinguished career. I have gotten to know Sue over the past 2…
1584,Donald Trump,"....I know Emmanuel means well, as do all others, but nobody speaks for the United States but the United States its…"
1585,Donald Trump,"Iran is in serious financial trouble. They want desperately to talk to the U.S., but are given mixed signals from a…"
1586,Donald Trump,"....in the world, there is nobody even close, but unfortunately the same cannot be said about our Federal Reserve.…"
1587,Donald Trump,"....John Deere, our car companies, &amp; others, to compete on a level playing field. With substantial Fed Cuts (there…"
1588,Donald Trump,"As your President, one would think that I would be thrilled with our very strong dollar. I am not! The Fed’s high i…"
1589,Donald Trump,"....I am so amazed that MSNBC &amp; CNN can keep putting on, over and over again, people that have no idea what I am al…"
1590,Donald Trump,"Just watched a world class loser, Tim O’Brien, who I haven’t seen or spoken to in many years, &amp; knows NOTHING about…"
1591,Donald Trump,My time spent in Dayton and El Paso with some of the greatest people on earth. Thank you for a job well done!
1592,Donald Trump,"Incredible afternoon in El Paso, Texas. We love you, and are with you, all the way!"
1593,Donald Trump,"The Dems new weapon is actually their old weapon, one which they never cease to use when they are down, or run out…"
1594,Donald Trump,"Leaving El Paso for the White House. What GREAT people I met there and in Dayton, Ohio. The Fake News worked overti…"
1595,Donald Trump,I don’t know who Joaquin Castro is other than the lesser brother of a failed presidential candidate (1%) who makes…
1596,Donald Trump,
1597,Donald Trump,The people I met today in Dayton are the finest anywhere!
1598,Donald Trump,"We love you Dayton, Ohio!"
1599,Donald Trump,"Watching Fake News CNN is better than watching Shepard Smith, the lowest rated show on @FoxNews. Actually, whenever…"
1600,Donald Trump,....misrepresenting what took place inside of the hospital. Their news conference after I left for El Paso was a fr…
1601,Donald Trump,"Just left Dayton, Ohio, where I met with the Victims &amp; families, Law Enforcement, Medical Staff &amp; First Responders.…"
1602,Donald Trump,Watching Sleepy Joe Biden making a speech. Sooo Boring! The LameStream Media will die in the ratings and clicks wit…
1603,Donald Trump,"Today, we honor all of our Country’s Purple Heart recipients, their loved ones, and our Gold Star Families for thei…"
1604,Donald Trump,"....terrible thing to watch, especially when things could be taken care of sooo easily. We will WIN anyway, but it…"
1605,Donald Trump,....proud to admit their mistake of acting too fast and tightening too much (and that I was right!). They must Cut…
1606,Donald Trump,"“Three more Central Banks cut rates.” Our problem is not China - We are stronger than ever, money is pouring into t…"
1607,Donald Trump,"“Meanwhile, the Dayton, Ohio, shooter had a history of supporting political figures like Bernie Sanders, Elizabeth…"
1608,Donald Trump,"..”This is an astounding development in journalism. I’ve never seen it happen before, I’ve just never seen anything…"
1609,Donald Trump,"“Trump Urges Unity Vs. Racism,” was the correct description in the first headline by the Failing New York Times, bu…"
1610,Donald Trump,...Talks have begun to further increase payments to the United States. South Korea is a very wealthy nation that no…
1611,Donald Trump,South Korea has agreed to pay substantially more money to the United States in order to defend itself from North Ko…
1612,Donald Trump,"Beto (phony name to indicate Hispanic heritage) O’Rourke, who is embarrassed by my last visit to the Great State of…"
1613,Donald Trump,....Amendment.” John Yoo. @IngrahamAngle Former Governor Jerry Brown vetoed the same bill in that it was ridiculou…
1614,Donald Trump,"“California is trying to meddle with a ballot in order to oppose President Trump, and it’s clearly something Califo…"
1615,Donald Trump,"Will be going to Dayton, Ohio and El Paso, Texas, tomorrow to meet with First Responders, Law Enforcement, and some…"
1616,Donald Trump,...in 2020.” Lou Dobbs stated that this is a fraud on the American public. @peterschweizer stated with certainty th…
1617,Donald Trump,... are NOT planning to illegally subvert the 2020 Election despite all that has been said to the contrary. It all…
1618,Donald Trump,".@sundarpichai of Google was in the Oval Office working very hard to explain how much he liked me, what a great job…"
1619,Donald Trump,Thank you @JimCramer @CNBC!
1620,Donald Trump,"Thank you Mr. Wonderful, I like you too! @kevinolearytv @CNBC"
1621,Donald Trump,"As they have learned in the last two years, our great American Farmers know that China will not be able to hurt the…"
1622,Donald Trump,Massive amounts of money from China and other parts of the world is pouring into the United States for reasons of s…
1623,Donald Trump,“It’s political season and the election is around the corner. They want to continue to push that racist narrative.”…
1624,Donald Trump,“Did George Bush ever condemn President Obama after Sandy Hook. President Obama had 32 mass shootings during his re…
1625,Donald Trump,Thank you @PeterSchweizer!
1626,Donald Trump,Check out what @Google is up to for the 2020 election! #KAG2020
1627,Donald Trump,Thank you @LouDobbs and Tom Homan!
1628,Donald Trump,We must honor the sacred memory of those we have lost by acting as ONE PEOPLE. Open wounds cannot heal if we are di…
1629,Donald Trump,"Today, I am also directing the Department of Justice to propose legislation ensuring that those who commit hate cri…"
1630,Donald Trump,"The First Lady and I join all Americans in praying and grieving for the victims, their families, and the survivors.…"
1631,Donald Trump,China is intent on continuing to receive the hundreds of Billions of Dollars they have been taking from the U.S. wi…
1632,Donald Trump,"....used currency manipulation to steal our businesses and factories, hurt our jobs, depress our workers’ wages and…"
1633,Donald Trump,"Based on the historic currency manipulation by China, it is now even more obvious to everyone that Americans are no…"
1634,Donald Trump,China dropped the price of their currency to an almost a historic low. It’s called “currency manipulation.” Are you…
1635,Donald Trump,The Media has a big responsibility to life and safety in our Country. Fake News has contributed greatly to the ange…
1636,Donald Trump,"....this legislation with desperately needed immigration reform. We must have something good, if not GREAT, come ou…"
1637,Donald Trump,"We cannot let those killed in El Paso, Texas, and Dayton, Ohio, die in vain. Likewise for those so seriously wounde…"
1638,Donald Trump,"....The flags at the White House will be lowered today through Thursday, August 8. Melania and I are praying for al…"
1639,Donald Trump,"Today, I authorized the lowering of the flags to half-staff at all Federal Government buildings in honor of the vic…"
1640,Donald Trump,"God bless the people of El Paso, Texas. God bless the people of Dayton, Ohio."
1641,Donald Trump,"The FBI, local and state law enforcement are working together in El Paso and in Dayton, Ohio. Information is rapidl…"
1642,Donald Trump,....Melania and I send our heartfelt thoughts and prayers to the great people of Texas.
1643,Donald Trump,"Today’s shooting in El Paso, Texas, was not only tragic, it was an act of cowardice. I know that I stand with every…"
1644,Donald Trump,'God be with you all': Trump pledges full support for El Paso shooting victims as lawmakers also grieve…
1645,Donald Trump,"Pastor Scott, a great guy - and tough!"
1646,Donald Trump,Fight hard tonight Colby. You are a real Champ! #MAGA
1647,Donald Trump,"Terrible shootings in ElPaso, Texas. Reports are very bad, many killed. Working with State and Local authorities, a…"
1648,Donald Trump,"Things are going along very well with China. They are paying us Tens of Billions of Dollars, made possible by their…"
1649,Donald Trump,"Countries are coming to us wanting to negotiate REAL trade deals, not the one sided horror show deals made by past…"
1650,Donald Trump,Great working with you John. A big win for our amazing ranchers!
1651,Donald Trump,A great couple!
1652,Donald Trump,"Nice to see that one of my best pupils is still a giant Trump fan. Steve joined me after I won the primaries, but I…"
1653,Donald Trump,....John has therefore decided to stay in Congress where he has done such an outstanding job representing the peopl…
1654,Donald Trump,Our great Republican Congressman John Ratcliffe is being treated very unfairly by the LameStream Media. Rather than…
1655,Donald Trump,"A$AP Rocky released from prison and on his way home to the United States from Sweden. It was a Rocky Week, get home ASAP A$AP!"
1656,Donald Trump,"....Chariman Kim has a great and beautiful vision for his country, and only the United States, with me as President…"
1657,Donald Trump,".....Chairman Kim does not want to disappoint me with a violation of trust, there is far too much for North Korea t…"
1658,Donald Trump,Kim Jong Un and North Korea tested 3 short range missiles over the last number of days. These missiles tests are no…
1659,Donald Trump,Really bad news! The Baltimore house of Elijah Cummings was robbed. Too bad!
1660,Donald Trump,THANK YOU OHIO!! #KAG2020
1661,Donald Trump,"I would like to thank two Great Iowa Senators, @ChuckGrassley and @SenJoniErnst - for their support today on the Sp…"
1662,Donald Trump,"Beautiful evening in Cincinnati, Ohio tonight — with GREAT American Patriots! #KAG2020"
1663,Donald Trump,"Thank you Cincinnati, Ohio. Together, we are going to KEEP AMERICA GREAT!"
1664,Donald Trump,
1665,Donald Trump,"...We look forward to continuing our positive dialogue with China on a comprehensive Trade Deal, and feel that the…"
1666,Donald Trump,"...during the talks the U.S. will start, on September 1st, putting a small additional Tariff of 10% on the remainin…"
1667,Donald Trump,"...buy agricultural product from the U.S. in large quantities, but did not do so. Additionally, my friend President…"
1668,Donald Trump,Our representatives have just returned from China where they had constructive talks having to do with a future Trad…
1669,Donald Trump,
1670,Donald Trump,"""A string of court cases that have been run through the legal system that have hit DEAD ENDS...."" @BillHemmer…"
1671,Donald Trump,
1672,Donald Trump,"BIG RALLY tonight in Cincinnati, Ohio. See you there! P.S. Our Country is doing GREAT!"
1673,Donald Trump,"Budget Deal is phenomenal for our Great Military, our Vets, and Jobs, Jobs, Jobs! Two year deal gets us past the El…"
