,Name,Tweet
0,Donald Trump,A great try by @seanspicer. We are all proud of you!
1,Donald Trump,"“This isn’t about Ukraine. This isn’t about Impeachment. This is about subverting Democracy!” @BillOReilly So true,…"
2,Donald Trump,....want that to be an impeachable offense? Good luck with that!” @JesseBWatters @FoxNews
3,Donald Trump,"“The President has until September 30th to give this aid to Ukraine. He gets it out on September 11th., 3 weeks bef…"
4,Donald Trump,"Schiff and the Dems have created this whole thing, they reverse engineer it. They’ve been vowing to impeach for thr…"
5,Donald Trump,"In order to continue being the most Transparent President in history, I will be releasing sometime this week the Tr…"
6,Donald Trump,"Just like Schiff fabricated my phone call, he will fabricate the transcripts that he is making and releasing!"
7,Donald Trump,"Schiff is giving Republicans NO WITNESSES, NO LAWYER &amp; NO DUE PROCESS! It is a totally one sided Witch Hunt. This c…"
8,Donald Trump,Read the Transcript. It is PERFECT!
9,Donald Trump,To think I signed the Whistleblower Protection Act!
10,Donald Trump,Where is the Whistleblower who gave so much false information? Must testify along with Schiff and others!
11,Donald Trump,"Today, we come together as one Nation to salute the Veterans of the United States Armed Forces – the greatest warri…"
12,Donald Trump,"“The Chinese say (about Trump’s Trade War &amp; Tariffs), ‘he brought us to the table.’ This is the most prosperous eco…"
13,Donald Trump,Shifty Adam Schiff will only release doctored transcripts. We haven’t even seen the documents and are restricted fr…
14,Donald Trump,The lawyer for the Whistleblower takes away all credibility from this big Impeachment Scam! It should be ended and…
15,Donald Trump,"So with one Rally by me at the end of the campaign, I lift the poll numbers of Kentucky Governor Matt Bevin by 19 p…"
16,Donald Trump,"Will be meeting with representatives of the Vaping industry, together with medical professionals and individual sta…"
17,Donald Trump,HAPPY VETERANS DAY!
18,Donald Trump,https://t.co/5NgNEZJm8G
19,Donald Trump,https://t.co/LEjupyeKxw
20,Donald Trump,"A great new book just out, “The Plot Against the President. The True Story Of How Congressman Devin Nunes Uncovered…"
21,Donald Trump,"If Iran is able to turn over to the U.S. kidnapped former FBI Agent Robert A. Levinson, who has been missing in Ira…"
22,Donald Trump,
23,Donald Trump,
24,Donald Trump,
25,Donald Trump,".@NikkiHaley is out with a new book, “With All Due Respect” this week. Make sure you order your copy today, or stop…"
26,Donald Trump,The call to the Ukrainian President was PERFECT. Read the Transcript! There was NOTHING said that was in any way wr…
27,Donald Trump,“There’s nothing there! I’m trying to let the House know that they’re dividing America for no good reason. We’ve go…
28,Donald Trump,Corrupt politician Adam Schiff wants people from the White House to testify in his and Pelosi’s disgraceful Witch H…
29,Donald Trump,ABC is as bad as the rest of them. Journalistic standards are nonexistent today. The press is so dishonest that we…
30,Donald Trump,Make America Great Again!
31,Donald Trump,Such an amazing game &amp; place!
32,Donald Trump,https://t.co/KkZEHQMf8W
33,Donald Trump,“He is not a Whistleblower. He is a deepstater. Let the President do the job he was elected to do.” @JudgeJeanine
34,Donald Trump,Such GREAT people!
35,Donald Trump,Great!
36,Donald Trump,Thank you Andrew. Meadow was watching and is so proud of her great father and family!
37,Donald Trump,Thank you Terrence!
38,Donald Trump,But the Fake News will never show this. Thank you!
39,Donald Trump,Thank you to LSU and Alabama for a great game!
40,Donald Trump,Totally!
41,Donald Trump,A terrible lie. How can she do such a thing?
42,Donald Trump,Thank you Lee and David!
43,Donald Trump,95% Approval Rating in the Republican Party. Thank you! #MAGA #KAG2020
44,Donald Trump,....Whatever happened to the so-called “informer” to Whistleblower #1? Seems to have disappeared after I released t…
45,Donald Trump,"I recommend that Nervous Nancy Pelosi (who backed up Schiff’s lie), Shifty Adam Schiff, Sleepy Joe Biden, the Whist…"
46,Donald Trump,PRESIDENTIAL HARASSMENT!
47,Donald Trump,"But the Witch Hunt continues. After 3 years of relentless attacks against the Republican Party &amp; me, the Do Nothing…"
48,Donald Trump,Bringing the word “Nationalism” back into the mainstream - great job by Rich Lowry! Very important book.
49,Donald Trump,"Just finished reading my son Donald’s just out new book, “Triggered.” It is really good! He, along with many of us,…"
50,Donald Trump,We will win big!
51,Donald Trump,True!
52,Donald Trump,"Good luck Vince, this will be great!"
53,Donald Trump,"Fake News is reporting that I am talking to Mark Burnett about doing a big show, perhaps The Apprentice, after the…"
54,Donald Trump,"“Mark Levin blasts Adam Schiff, claims 'the law is on the president's side' on Ukraine”"
55,Donald Trump,I will be announcing the winners of the #MAGACHALLENGE and inviting them to the @WhiteHouse to meet with me and per…
56,Donald Trump,
57,Donald Trump,STATEMENT FROM PRESIDENT DONALD J. TRUMP
58,Donald Trump,Stock Market up big today. A New Record. Enjoy!
59,Donald Trump,The Radical Left Dems and LameStream Media are just trying to make it hard for Republicans and me to win in 2020. T…
60,Donald Trump,"The Amazon Washington Post and three lowlife reporters, Matt Zapotosky, Josh Dawsey, and Carol Leonnig, wrote anoth…"
61,Donald Trump,THANK YOU! #MAGA
62,Donald Trump,"It was just explained to me that for next weeks Fake Hearing (trial) in the House, as they interview Never Trumpers…"
63,Donald Trump,“What did Hunter Biden do for the money?” @SenJohnKennedy  A very good question. He and Sleepy Joe must testify!
64,Donald Trump,"Based on the information released last night about the Fake Whistleblowers attorney, the Impeachment Hoax should be…"
65,Donald Trump,Read the Transcript!
66,Donald Trump,The degenerate Washington Post MADE UP the story about me asking Bill Barr to hold a news conference. Never happene…
67,Donald Trump,Bill Barr did not decline my request to talk about Ukraine. The story was a Fake Washington Post con job with an “a…
68,Donald Trump,"Just returned to the @WhiteHouse after a great evening in Monroe, Louisiana with a massive turnout of Great America…"
69,Donald Trump,"....The LameStream Media, which is The Enemy of the People, is working overtime with made up stories in order to dr…"
70,Donald Trump,"The story in the Amazon Washington Post, of course picked up by Fake News CNN, saying “President Trump asked for AG…"
71,Donald Trump,"Years ago, when Media was legitimate, people known as “Fact Checkers” would always call to check and see if a story…"
72,Donald Trump,"LOUISIANA! Early voting is underway until Saturday, it’s time to get out and VOTE to REPLACE Radical Liberal Democr…"
73,Donald Trump,
74,Donald Trump,"A great evening last night in Kentucky and Mississippi for the Republican Party with 13 BIG WINS, including a Gover…"
75,Donald Trump,"Thanks to many of you here today, my Administration and Republicans in Congress have now confirmed 157 FEDERAL JUDG…"
76,Donald Trump,"....Also talked about their Border with Syria, the eradication of terrorism, the ending of hostilities with the Kur…"
77,Donald Trump,Just had a very good call with President @RTErdogan of Turkey. He informed me that they have captured numerous ISIS…
78,Donald Trump,"Just had a meeting with top representatives from Egypt, Ethiopia, and Sudan to help solve their long running disput…"
79,Donald Trump,Stock Markets (all three) hit another ALL TIME &amp; HISTORIC HIGH yesterday! You are sooo lucky to have me as your Pre…
80,Donald Trump,"Thank you to Kurt Volker, U.S. Envoy to Ukraine, who said in his Congressional Testimony, just released, “You asked…"
81,Donald Trump,"“Based on the things I’ve seen, the Democrats have no case, or a weak case, at best. I don’t think there are, or wi…"
82,Donald Trump,"Based on the Kentucky results, Mitch McConnell @senatemajldr will win BIG in Kentucky next year!"
83,Donald Trump,Great going Tate!
84,Donald Trump,Our big Kentucky Rally on Monday night had a massive impact on all of the races. The increase in Governors race was…
85,Donald Trump,A lot of winning in Kentucky. Check out the numbers.
86,Donald Trump,Congratulations to @tatereeves on winning Governor of the Great State of Mississippi. Our big Rally on Friday night…
87,Donald Trump,"#ElectionNight Won 5 out of 6 elections in Kentucky, including 5 great candidates that I spoke for and introduced…"
88,Donald Trump,"Great going Daniel, proud of you!"
89,Donald Trump,95% Approval Rating in the Republican Party. Thank you!
90,Donald Trump,KENTUCKY! #KYGov Get out today and VOTE for @MattBevin and the entire Republican ticket! MISSISSIPPI! #MSGov…
91,Donald Trump,Thank you so much CLUB 45. You are truly Great Americans. See you in Florida!
92,Donald Trump,KENTUCKY! Get out today and VOTE for @MattBevin and the entire Republican ticket! MISSISSIPPI! Get out tod…
93,Donald Trump,A very good start! Please all work hard to get a final deal.
94,Donald Trump,"So sad to see what is happening in New York where Governor Cuomo &amp; Mayor DeBlasio are letting out 900 Criminals, s…"
95,Donald Trump,FIND YOUR POLLING LOCATION HERE!
96,Donald Trump,"This is the time for Mexico, with the help of the United States, to wage WAR on the drug cartels and wipe them off…"
97,Donald Trump,"....monsters, the United States stands ready, willing &amp; able to get involved and do the job quickly and effectively…"
98,Donald Trump,"A wonderful family and friends from Utah got caught between two vicious drug cartels, who were shooting at each oth…"
99,Donald Trump,"“The Impeachment Hoax has fired up voters in Kentucky, Mississippi and Louisiana.” @foxandfriends"
100,Donald Trump,Fantastic being in the Great State of Kentucky last night. Vote for Matt Bevin NOW! @MattBevin One of Best Governo…
101,Donald Trump,The Do Nothing Dems have gone Radical Left Crazy. The can’t get anything done!
102,Donald Trump,"Virginia, with all of the massive amount of defense and other work I brought to you, and with everything planned, g…"
103,Donald Trump,Vote for Sean Spicer on Dancing with the Stars. He is a great and very loyal guy who is working very hard! #MAGA
104,Donald Trump,"My son, @DonaldJTrumpJr is coming out with a new book, “Triggered: How the Left Thrives on Hate and Wants to Silenc…"
105,Donald Trump,All-Time High for Stock Market and all the Fake News wants to talk about is the Impeachment Hoax!
106,Donald Trump,Read the Transcript!
107,Donald Trump,"Big Rally in Kentucky TONIGHT for a man who has worked really hard &amp; done a GREAT job, Gov @MattBevin. Kentucky is…"
108,Donald Trump,"....I don’t like him using my name to build his consulting company, or whatever. Please advise his clients and Admi…"
109,Donald Trump,"Many people say they know me, claiming to be “best friends” and really close etc., when I don’t know these people a…"
110,Donald Trump,Stock Market hits RECORD HIGH. Spend your money well!
111,Donald Trump,“There is no Whistleblower. There is someone with an agenda against Donald Trump. What he was blowing the whistle o…
112,Donald Trump,95% Approval Rating in the Republican Party. Thank you!
113,Donald Trump,The Whistleblower gave false information &amp; dealt with corrupt politician Schiff. He must be brought forward to test…
114,Donald Trump,What I said on the phone call with the Ukrainian President is “perfectly” stated. There is no reason to call witnes…
115,Donald Trump,"Mark Levin, a great lawyer and scholar, said last night on his @marklevinshow, that all you have to do is read the…"
116,Donald Trump,Great! But how do you know it was a “mistweet?” May be something with deep meaning!
117,Donald Trump,"Louisiana, get out and Vote Early for @EddieRispone as your next Governor. Lower Taxes and car insurance. Will prot…"
118,Donald Trump,"Great Republican Geary Higgins has my complete and total Endorsement for Virginia Senate, 13th District. He is stro…"
119,Donald Trump,"@marklevinshow Mark Levin: “We ought to talk about the substance of this phone call. We have the call, I don’t know…"
120,Donald Trump,Good point!
121,Donald Trump,We won’t Steve!
122,Donald Trump,Don’t miss this show!
123,Donald Trump,False stories are being reported that a few Republican Senators are saying that President Trump may have done a qui…
124,Donald Trump,....should give their own transcripts of the interviews to contrast with Schiff’s manipulated propaganda. House Rep…
125,Donald Trump,"If Shifty Adam Schiff, who is a corrupt politician who fraudulently made up what I said on the “call,” is allowed t…"
126,Donald Trump,
127,Donald Trump,"Virginia has the best Unemployment and Economic numbers in the history of the State. If the Democrats get in, those…"
128,Donald Trump,I hope everyone in the Great State of Virginia will get out and VOTE on Tuesday in all of the local and state elect…
129,Donald Trump,"The Fake News Media is working hard so that information about the Whistleblower’s identity, which may be very bad f…"
130,Donald Trump,"The Democrats are Fixers, and they are working overtime to FIX the Impeachment “Process” in order to hurt the Repub…"
131,Donald Trump,Fake News!
132,Donald Trump,The Angry Majority!
133,Donald Trump,Many people listened to my phone call with the Ukrainian President while it was being made. I never heard any compl…
134,Donald Trump,....and FEDERAL CONTRACTOR SPIES stories. The finest law enforcement on the planet could not have shown a ROADMAP l…
135,Donald Trump,Thank you to @OANN for the absolutely incredible Special Report narrated by @PearsonSharp. Seldom do the American p…
136,Donald Trump,“Morrison testifies he saw nothing wrong with the Trump call.” @OANN
137,Donald Trump,"....Matt has been a GREAT Governor. Kentucky (I Love You!), please be sure to vote for Matt Bevin on TUESDAY. Matt…"
138,Donald Trump,Walking into Madison Square Garden last night with @danawhite for the big @UFC Championship fight was a little bit…
139,Donald Trump,Great fight Champ!
140,Donald Trump,"The Whistleblower got it sooo wrong that HE must come forward. The Fake News Media knows who he is but, being an ar…"
141,Donald Trump,"....putting these massive, and many, fires out. Great firefighters! Also, open up the ridiculously closed water lan…"
142,Donald Trump,"..Every year, as the fire’s rage &amp; California burns, it is the same thing-and then he comes to the Federal Governme…"
143,Donald Trump,"The Governor of California, @GavinNewsom, has done a terrible job of forest management. I told him from the first d…"
144,Donald Trump,
145,Donald Trump,Didn’t he pick the Whistleblower?
146,Donald Trump,A giant Scam!
147,Donald Trump,Schiff will change the transcripts just like he fraudulently made up the phone call. He is a corrupt politician!
148,Donald Trump,The Whistleblower has disappeared. Where is the Whistleblower?
149,Donald Trump,"Big Rally in Kentucky on Monday night for a man who has worked really hard &amp; done a GREAT job, Governor @MattBevin.…"
150,Donald Trump,Louisiana has a chance to have a really great Governor in @EddieRispone. Auto insurance costs and taxes will be com…
151,Donald Trump,"Tate Reeves will be a great Governor of Mississippi, and what an electric Rally last night. Vote for Tate on Tuesda…"
152,Donald Trump,"A great new book by Howie Carr, “What Really Happened, How Donald J. Trump Saved America From Hillary Clinton,” is…"
153,Donald Trump,The Whistleblower must come forward to explain why his account of the phone call with the Ukrainian President was s…
154,Donald Trump,You can’t Impeach someone who hasn’t done anything wrong!
155,Donald Trump,"Oh no, Beto just dropped out of race for President despite him saying he was “born for this.” I don’t think so!"
156,Donald Trump,Republicans have never been more unified than they are right now! The Dems are a mess under the corrupt leadership…
157,Donald Trump,.....with a President and Federal Government that wants our wonerful City and State to flourish and thrive. I Love New York!
158,Donald Trump,"....our great police are being disrespected, even with water dumped on them, because a Mayor and Governor just don’…"
159,Donald Trump,"....in New York, and another reason they are leaving. Taxes and energy costs are way too high, Upstate is being all…"
160,Donald Trump,"I love New York, but New York can never be great again under the current leadership of Governor Andrew Cuomo (the b…"
161,Donald Trump,Stock Market up BIG! Record highs for S&amp;P 500 and NASDAQ. Enjoy!
162,Donald Trump,....Our Republican candidate @EddieRispone is a successful conservative businessman who will stand with me to creat…
163,Donald Trump,LOUISIANA! Extreme Democrat John Bel Edwards has sided with Nancy Pelosi and Chuck Schumer to support Sanctuary Cit…
164,Donald Trump,....@FoxNews @BillHemmer The public is watching and seeing for themselves how unfair this process is. Corrupt pol…
165,Donald Trump,"“Adam Schiff has taken all of the power for himself. That is very unfair. There were dozens of people on this call,…"
166,Donald Trump,ISIS has a new leader. We know exactly who he is!
167,Donald Trump,“The Democrats need more than this.” @tombrokaw  Much more!
168,Donald Trump,“The Democrats are so immersed in this (SCAM). They couldn’t care less about the American people!” @RushLimbaughEIB
169,Donald Trump,"Wow, a blowout JOBS number just out, adjusted for revisions and the General Motors strike, 303,000. This is far gre…"
170,Donald Trump,Chicago will never stop its crime wave with the current Superintendent of Police. It just won’t happen! Thank you t…
171,Donald Trump,"“This is the biggest, most disgusting scandal, and it’s all on the Democrat Party that has highjacked the Impeachm…"
172,Donald Trump,“It has been 3 years and Donald Trump hasn’t done anything wrong. Donald Trump hasn’t done a single thing of which…
173,Donald Trump,Thanks Lee!
174,Donald Trump,But the Crooked Democrats don’t want people to know this! Thank you to Tim Morrison for your honesty.
175,Donald Trump,A great place!
176,Donald Trump,Thank you!
177,Donald Trump,"....this decision, but in the end it will be best for all concerned. As President, I will always be there to help N…"
178,Donald Trump,"....New York, and always will, but unfortunately, despite the fact that I pay millions of dollars in city, state an…"
179,Donald Trump,"1600 Pennsylvania Avenue, the White House, is the place I have come to love and will stay for, hopefully, another 5…"
180,Donald Trump,The home of Nancy Pelosi. I can’t believe her voters can be happy with the job she and the Do Nothing Democrats are…
181,Donald Trump,"While the Do Nothing Democrats FAIL the American People, and continue the Impeachment Scam, my Administration will…"
182,Donald Trump,The Greatest Witch Hunt In American History!
183,Donald Trump,The Impeachment Hoax is hurting our Stock Market. The Do Nothing Democrats don’t care!
184,Donald Trump,"....our manufacturers. We should have lower interest rates than Germany, Japan and all others. We are now, by far,…"
185,Donald Trump,"People are VERY disappointed in Jay Powell and the Federal Reserve. The Fed has called it wrong from the beginning,…"
186,Donald Trump,READ THE TRANSCRIPT!
187,Donald Trump,"China and the USA are working on selecting a new site for signing of Phase One of Trade Agreement, about 60% of tot…"
188,Donald Trump,"Congratulations to @FoxNews, you left @CNN &amp; @MSNBC in the dust (that’s because the don’t tell the truth!)."
189,Donald Trump,Thank you Matt.
190,Donald Trump,".....to any President, of either party, again. Laura @IngrahamAngle"
191,Donald Trump,"...never be allowed to roll into a winter showtrial. Indeed, allowing a long, drawn out trial in the Senate would m…"
192,Donald Trump,".....the Dems have selectively leaked. Nor was there any corrupt intent on the part of the President. Remember, the…"
193,Donald Trump,“Now is the time for Republicans to stand together and defend the leader of their party against these smears. It wo…
194,Donald Trump,Congratulations to the Washington Nationals on a great season and an incredible World Series. Game 7 was amazing! @Nationals
195,Donald Trump,"Thank you Daily Wire. Very cute recreation, but the “live” version of Conan will be leaving the Middle East for the…"
196,Donald Trump,The Do Nothing Democrats have gone Crazy. Very bad for USA!
197,Donald Trump,
198,Donald Trump,"""The Democrats have been on this path for 3 years. The first headline I saw...before the President was sworn in was…"
199,Donald Trump,Thank you @GLFOP!
200,Donald Trump,"“Adam Schiff’s drive to impeach Trump based on opinions, deception and illusions – Not facts” @GreggJarrett"
201,Donald Trump,We will be having a big rally for Governor @MattBevin on Monday night in Kentucky. Get your tickets today!
202,Donald Trump,"....Your current Governor, John Bel Edwards, has done a poor job with economic development (last in nation) and aut…"
203,Donald Trump,"Early voting in Louisiana for a man who will be a Great Governor, @EddieRispone, on Saturday, November 2nd. He will…"
204,Donald Trump,AMERICAN HERO!
205,Donald Trump,"Thank you @GM, @FiatChrysler_NA, @Toyota, and @GloblAutomkrs for standing with us for Better, Cheaper, Safer Cars f…"
206,Donald Trump,"...our Military, 2nd Amendment, Energy, and so many other things that the Democrats don’t care about. Please stop t…"
207,Donald Trump,"My friend Mike @GovDunleavy of the Great State of Alaska, is being treated very unfairly by the Democrats because h…"
208,Donald Trump,....the United States Military. Congress needs to do its work. We need to fund our Armed Forces.” @senatemajldr Mi…
209,Donald Trump,“Our Country cannot afford for the Democrats in Congress to take a one year vacation from any productive legislatio…
210,Donald Trump,"“Precisely the same program that the Democrats are trying to Impeach President Trump for supposedly slow walking,…"
211,Donald Trump,Yesterday’s Never Trumper witness could find NO Quid Pro Quo in the Transcript of the phone call. There were many p…
212,Donald Trump,A Federal Judge is allowing the Nick Sandman libel suit to move forward against the thoroughly disgusting Washingto…
213,Donald Trump,“It does appear it has to do with Nancy Pelosi retaining her Speakership in the next Congress. She would like that…
214,Donald Trump,The Greatest Economy in American History!
215,Donald Trump,".....the call with the Ukrainian President was a totally appropriate one. As he said, “No Pressure.” This Impeachme…"
216,Donald Trump,"Republicans are very unified and energized in our fight on the Impeachment Hoax with the Do Nothing Democrats, and…"
217,Donald Trump,Nervous Nancy Pelosi is doing everything possible to destroy the Republican Party. Our Polls show that it is going…
218,Donald Trump,“Over in Europe and Japan they have NEGATIVE RATES. They get paid to borrow money. Don’t we have to follow our comp…
219,Donald Trump,Consumer Confidence number very good. Housing sales in September up nicely. Economy Rocks!
220,Donald Trump,"A great new book just out, “The Plot Against the President. The True Story Of How Congressman Devin Nunez Uncovered…"
221,Donald Trump,Just confirmed that Abu Bakr al-Baghdadi’s number one replacement has been terminated by American troops. Most like…
222,Donald Trump,"95% Approval Rating in the Republican Party, a record. Thank you!"
223,Donald Trump,"Supposedly, according to the Corrupt Media, the Ukraine call “concerned” today’s Never Trumper witness. Was he on t…"
224,Donald Trump,How many more Never Trumpers will be allowed to testify about a perfectly appropriate phone call when all anyone ha…
225,Donald Trump,"The Do Nothing Democrats are working hard to make everyone forget the Best Economy Ever, the monumental weekend rai…"
226,Donald Trump,"Where’s the Whistleblower? Just read the Transcript, everything else is made up garbage by Shifty Schiff and the Never Trumpers!"
227,Donald Trump,A great book by a great guy. Get it now!
228,Donald Trump,"Correct, a total scam!"
229,Donald Trump,Why are people that I never even heard of testifying about the call. Just READ THE CALL TRANSCRIPT AND THE IMPEACHM…
230,Donald Trump,"“This is a big win for America, and also for President Trump.” @nypost"
231,Donald Trump,"The only crimes in the Impeachment Hoax were committed by Shifty Adam Schiff, when he totally made up my phone conv…"
232,Donald Trump,"“There is no underlying crime in that transcript.” @IngrahamAngle 100% correct, and the Whistleblower disappeared…"
233,Donald Trump,“Americans know by now that the Impeachment inquiry is just another hoax and silent coup to remove the President fr…
234,Donald Trump,"Can you believe that Shifty Adam Schiff, the biggest leaker in D.C., and a corrupt politician, is upset that we did…"
235,Donald Trump,"So nice, thank you!"
236,Donald Trump,We have declassified a picture of the wonderful dog (name not declassified) that did such a GREAT JOB in capturing…
237,Donald Trump,An AMAZING CHAMPION. Great going Tiger! @TigerWoods
238,Donald Trump,THANK YOU #IACP2019!
239,Donald Trump,"The S&amp;P just hit an ALL TIME HIGH. This is a big win for jobs, 401-K’s, and, frankly, EVERYONE! Our Country is doin…"
