,Name,Tweet
485,Donald Trump,"We have become a far greater Economic Power than ever before, and we are using that power for WORLD PEACE!"
486,Donald Trump,Where’s Hunter? He has totally disappeared! Now looks like he has raided and scammed even more countries! Media is AWOL.
487,Donald Trump,"Dealing with @LindseyGrahamSC and many members of Congress, including Democrats, about imposing powerful Sanctions…"
488,Donald Trump,.....The Kurds and Turkey have been fighting for many years. Turkey considers the PKK the worst terrorists of all.…
489,Donald Trump,Do you remember two years ago when Iraq was going to fight the Kurds in a different part of Syria. Many people want…
490,Donald Trump,"Very smart not to be involved in the intense fighting along the Turkish Border, for a change. Those that mistakenly…"
491,Donald Trump,The Media is not talking about the big Republican victory last night in Louisiana where a sitting Democrat Governor…
492,Donald Trump,A despicable human being!
493,Donald Trump,"Congratulations to the Great State of Louisiana. A big night. You will soon have a new and wonderful Governor,…"
494,Donald Trump,"The same people that got us into the Middle East Quicksand, 8 Trillion Dollars and many thousands of lives (and mil…"
495,Donald Trump,"The Governor of Louisiana, John Bel Edwards, has done a poor job. NOW HE IS IN A RUNOFF WITH A GREAT REPUBLICAN,…"
496,Donald Trump,The Endless Wars Must End!
497,Donald Trump,Start thinking about getting bigger tractors!
498,Donald Trump,That is the real story!
499,Donald Trump,Happy National Farmers Day!
500,Donald Trump,https://t.co/YBmYOsGdK3
501,Donald Trump,
502,Donald Trump,"So now they are after the legendary “crime buster” and greatest Mayor in the history of NYC, Rudy Giuliani. He may…"
503,Donald Trump,"Louisiana, get out and vote REPUBLICAN before going to the big game today. A runoff will be a tremendous win for yo…"
504,Donald Trump,"....Other aspects of the deal are also great - technology, financial services, 16-20 Billion in Boeing Planes etc.,…"
505,Donald Trump,"The deal I just made with China is, by far, the greatest and biggest deal ever made for our Great Patriot Farmers i…"
506,Donald Trump,The case of Major Mathew Golsteyn is now under review at the White House. Mathew is a highly decorated Green Beret…
507,Donald Trump,“Schiff aides worked with Whistleblower.” @foxandfriends  @RepLeeZeldin  Schiff is a lying mess!
508,Donald Trump,"LOUISIANA — Tomorrow, you will head to the polls and VOTE to REPLACE Liberal Democrat John Bel Edwards with a great…"
509,Donald Trump,"Louisiana REPUBLICANS, thank you for a great evening. Get out TOMORROW and VOTE REPUBLICAN! Send the Radical Democr…"
510,Donald Trump,"“I never saw so many subpoenas!” @ShannonBream @FoxNews The Democrats have gone Crazy. Just read the Transcript,…"
511,Donald Trump,"So funny to watch Steve Kerr grovel and pander when asked a simple question about China. He chocked, and looks weak…"
512,Donald Trump,WHERE’S HUNTER?
513,Donald Trump,"Is he leaving due to bad ratings, or some other less important reason?"
514,Donald Trump,"Just landed in Louisiana! Vote against John Bel Edwards, he has the worst jobs record in the United States. Louisia…"
515,Donald Trump,"....Congratulations Kevin, on a job well done! I will be announcing the new Acting Secretary next week. Many wonderful candidates!"
516,Donald Trump,Kevin McAleenan has done an outstanding job as Acting Secretary of Homeland Security. We have worked well together…
517,Donald Trump,A terrible and very dishonest person!
518,Donald Trump,"We love you @MinneapolisPD, THANK YOU! #LESM"
519,Donald Trump,Really good news!
520,Donald Trump,So Great!
521,Donald Trump,A Giant Scam!
522,Donald Trump,Amazing Evening!
523,Donald Trump,The Do Nothing Democrats. Thanks Vicky!
524,Donald Trump,Do you believe this? A total Scam!
525,Donald Trump,A great evening in beautiful Minnesota!
526,Donald Trump,What a disgraceful legal system for this guy to still be around after all of these years. A vicious killer who dest…
527,Donald Trump,"Will be with our two GREAT Senators, @SenJohnKennedy &amp; @SenBillCassidy, tonight in Louisiana. These two hard workin…"
528,Donald Trump,"One of the great things about the China Deal is the fact that, for various reasons, we do not have to go through th…"
529,Donald Trump,I will be in Louisiana tonight (Love it!) to get Republicans to vote for either of our two great Republican Candida…
530,Donald Trump,"Good things are happening at China Trade Talk Meeting. Warmer feelings than in recent past, more like the Old Days.…"
531,Donald Trump,"Over the next 13 months, we are going to fight with all of our heart and soul – and we are going to win the Great S…"
532,Donald Trump,"A GREAT evening in Minneapolis, Minnesota with incredible American Patriots. THANK YOU!"
533,Donald Trump,The joint statement released with President Bolsonaro in March makes absolutely clear that I support Brazil beginni…
534,Donald Trump,"WOW, THANK YOU Minneapolis, Minnesota — on my way! #KAG2020"
535,Donald Trump,"....We have one of three choices: Send in thousands of troops and win Militarily, hit Turkey very hard Financially…"
536,Donald Trump,"We defeated 100% of the ISIS Caliphate and no longer have any troops in the area under attack by Turkey, in Syria.…"
537,Donald Trump,
538,Donald Trump,
539,Donald Trump,"Big day of negotiations with China. They want to make a deal, but do I? I meet with the Vice Premier tomorrow at The White House."
540,Donald Trump,Why isn’t the IG investigating his so-called Whistleblower? All bad info!
541,Donald Trump,"The President of the Ukraine just stated again, in the strongest of language, that President Trump applied no press…"
542,Donald Trump,Thank you to @OANN One America News for your fair coverage and brilliant reporting. It is appreciated by many peopl…
543,Donald Trump,"....the area and start a new war all over again. Turkey is a member of NATO. Others say STAY OUT, let the Kurds fig…"
544,Donald Trump,Turkey has been planning to attack the Kurds for a long time. They have been fighting forever. We have no soldiers…
545,Donald Trump,Where is Hunter Biden? He has disappeared while the Fake News protects his Crooked daddy!
546,Donald Trump,"...Court Justice &amp; I turned him down (he’s been terrible ever since), Shep Smith, @donnabrazile (who gave Crooked H…"
547,Donald Trump,"From the day I announced I was running for President, I have NEVER had a good @FoxNews Poll. Whoever their Pollster…"
548,Donald Trump,“Ukrainian President Volodymyr Zelensky told reporters Thursday his controversial July call with President Trump in…
549,Donald Trump,"In case the Kurds or Turkey lose control, the United States has already taken the 2 ISIS militants tied to beheadin…"
550,Donald Trump,"Impeached for what, having created the greatest Economy in the history of our Country, building our strongest ever…"
551,Donald Trump,A different take!
552,Donald Trump,“I don’t think it’s a Whistleblower at all. I think this is an anonymous source for the Democratic Staff in the Hou…
553,Donald Trump,
554,Donald Trump,The hardest thing I have to do as President...
555,Donald Trump,Sleepy Joe Biden!
556,Donald Trump,"So pathetic to see Sleepy Joe Biden, who with his son, Hunter, and to the detriment of the American Taxpayer, has r…"
557,Donald Trump,"Only 25 percent want the President Impeached, which is pretty low considering the volume of Fake News coverage, but…"
558,Donald Trump,So why is someone a good or great President if they needed to Spy on someone else’s Campaign in order to win (that…
559,Donald Trump,"....DACA stand, with all of its negative legal implications, the Republicans and Democrats will have a DEAL to let…"
560,Donald Trump,"President Obama said that he did not have the right to sign DACA, that it will never hold up in court. He signed it…"
561,Donald Trump,Crooked Hillary should try it again!
562,Donald Trump,True. Should have never been there in the first place!
563,Donald Trump,"Why doesn’t the ICIG do something about this Scam? He should have never let it start, a Dem Hoax!"
564,Donald Trump,Adam Schiff is a disgrace to our Country!
565,Donald Trump,"So true Don, and this was a big lie. Look what happened to Friends of Trump, for less. Can’t let this pass!"
566,Donald Trump,"But we are now, for the first time, giving companies a better alternative!"
567,Donald Trump,"Great support from GOP in fighting the Radical Left, Do Nothing Democrats!"
568,Donald Trump,"They don’t have a clue, but I do. The USA is doing great despite the Fed!"
569,Donald Trump,"....No Pressure at all said Ukraine! Very congenial, a perfect call. The Whistleblower and others spoke BEFORE seei…"
570,Donald Trump,"The so-called Whistleblower, before knowing I was going to release the exact Transcript, stated that my call with t…"
571,Donald Trump,"The Do Nothing Democrats are Con Artists, only looking to hurt the Republican Party and President. Their total focu…"
572,Donald Trump,"....IN THE HISTORY OF OUR COUNTRY! We went to war under a false &amp; now disproven premise, WEAPONS OF MASS DESTRUCTIO…"
573,Donald Trump,The United States has spent EIGHT TRILLION DOLLARS fighting and policing in the Middle East. Thousands of our Great…
574,Donald Trump,Fighting between various groups that has been going on for hundreds of years. USA should never have been in Middle…
575,Donald Trump,"So make all Member Countries pay, not just the United States!"
576,Donald Trump,He should be Impeached for Fraud!
577,Donald Trump,.....The Whistleblower’s lawyer is a big Democrat. The Whistleblower has ties to one of my DEMOCRAT OPPONENTS. Why…
578,Donald Trump,"The Whistleblower’s facts have been so incorrect about my “no pressure” conversation with the Ukrainian President,…"
579,Donald Trump,"A Total Scam by the Do Nothing Democrats. For the good of the Country, this Wirch Hunt should end now!"
580,Donald Trump,So amazing!
581,Donald Trump,
582,Donald Trump,
583,Donald Trump,"Wow, Just Breaking: “The (big deal) Whistleblower had a ‘PROFESSIONAL TIE’ to 2020 Democratic Candidate.” Washingto…"
584,Donald Trump,"“Bob Mueller was pursuing the FBI Director job when he met with President Trump in 2017, Administration officials s…"
585,Donald Trump,The Greatest Witch Hunt in the history of the USA!
586,Donald Trump,Gasoline Prices in the State of California are MUCH HIGHER than anywhere else in the Nation ($2.50 vs. $4.50). I gu…
587,Donald Trump,"....If there is a Runoff in Louisiana, you will have a great new Republican Governor who will Cut your Taxes and Ca…"
588,Donald Trump,"Big Rally in Louisiana on Friday night. Must force a runoff with a Liberal Democrat Governor, John Bel Edwards, who…"
589,Donald Trump,"This is just the beginning, thank you to @ByronYork!"
590,Donald Trump,The U.S. Border is SECURE!
591,Donald Trump,"....In fact, the “Cops For Trump” T-shirt Web Site CRASHED because of incredible volume, but is now back up and run…"
592,Donald Trump,"Radical Left Dem Mayor of Minneapolis, Jacob Frey, is doing everything possible to stifle Free Speech despite a rec…"
593,Donald Trump,Friday night in Louisiana will be Great. Big crowd expected. Republicans must get out and vote for either of our tw…
594,Donald Trump,Hasn’t Adam Schiff been fully discredited by now? Do we have to continue listening to his lies?
595,Donald Trump,
596,Donald Trump,"Get your great T-Shirts, “Cops for Trump,” at https://t.co/pmhDDXsIlx REALLY NICE! Thank you to Minneapolis Police…"
597,Donald Trump,Someone please tell the Radical Left Mayor of Minneapolis that he can’t price out Free Speech. Probably illegal! I…
598,Donald Trump,Thank you to Lt. Bob Kroll of the great Minneapolis Police Department for your kind words on @foxandfriends. The Po…
599,Donald Trump,I think that Crooked Hillary Clinton should enter the race to try and steal it away from Uber Left Elizabeth Warren…
600,Donald Trump,"....to see. Importantly, Ambassador Sondland’s tweet, which few report, stated, “I believe you are incorrect about…"
601,Donald Trump,"I would love to send Ambassador Sondland, a really good man and great American, to testify, but unfortunately he wo…"
602,Donald Trump,"....understands that while we only had 50 soldiers remaining in that section of Syria, and they have been removed,…"
603,Donald Trump,"We may be in the process of leaving Syria, but in no way have we Abandoned the Kurds, who are special people and wo…"
604,Donald Trump,".....good health, at my request, Pastor Brunson, who had many years of a long prison term remaining. Also remember,…"
605,Donald Trump,"So many people conveniently forget that Turkey is a big trading partner of the United States, in fact they make the…"
606,Donald Trump,"The lightweight mayor is hurting the great police and other wonderful supporters. 72,000 ticket requests already. D…"
607,Donald Trump,Thank you Joni!
608,Donald Trump,Adam should be Impeached!
609,Donald Trump,Great book!
610,Donald Trump,"“There are no felonies, there are no Impeachable offenses. The Constitution’s very clear that you need bribery, tre…"
611,Donald Trump,
612,Donald Trump,Thank you @HeyTammyBruce!
613,Donald Trump,"""The Truth About Impeachment""@SteveHiltonx @NextRevFNC"
614,Donald Trump,"....the captured ISIS fighters and families. The U.S. has done far more than anyone could have ever expected, inclu…"
615,Donald Trump,"As I have stated strongly before, and just to reiterate, if Turkey does anything that I, in my great and unmatched…"
616,Donald Trump,"....down, watching over a quagmire, &amp; spending big dollars to do so. When I took over, our Military was totally dep…"
617,Donald Trump,"I was elected on getting out of these ridiculous endless wars, where our great Military functions as a policing ope…"
618,Donald Trump,"The Radical Left Democrats have failed on all fronts, so now they are pushing local New York City and State Democra…"
619,Donald Trump,"....doesn’t even include the almost $2000 that the families got from the Trump Tax Cut.” Stephen Moore, Freedomwork…"
620,Donald Trump,"Heritage Foundation “These numbers are blockbusters. Just since Donald Trump took office, Median Family Incomrs are…"
621,Donald Trump,"“Incomes much higher under Trump than Bush, Obama.” @foxandfriends And almost everything else is better also (excep…"
622,Donald Trump,“IG: DECLASSIFIED INFORMATION CONTRADICTS THE WHISTLEBLOWER.” @foxandfriends But why are people surprised? The “pa…
623,Donald Trump,We just WON the big court case on Net Neutrality Rules! A great win for the future and speed of the internet. Will…
624,Donald Trump,"...figure the situation out, and what they want to do with the captured ISIS fighters in their “neighborhood.” They…"
625,Donald Trump,"....almost 3 years, but it is time for us to get out of these ridiculous Endless Wars, many of them tribal, and bri…"
626,Donald Trump,".....again said “NO,” thinking, as usual, that the U.S. is always the “sucker,” on NATO, on Trade, on everything. T…"
627,Donald Trump,"....including capturing thousands of ISIS fighters, mostly from Europe. But Europe did not want them back, they sai…"
628,Donald Trump,"The United States was supposed to be in Syria for 30 days, that was many years ago. We stayed and got deeper and de…"
629,Donald Trump,"....This makes Nervous Nancy every bit as guilty as Liddle’ Adam Schiff for High Crimes and Misdemeanors, and even…"
630,Donald Trump,Nancy Pelosi knew of all of the many Shifty Adam Schiff lies and massive frauds perpetrated upon Congress and the A…
631,Donald Trump,".@60Minutes “forgot” to report that we are helping the great farmers of the USA to the tune of 28 Billion Dollars,…"
632,Donald Trump,"Unemployment Rate just dropped to 3.5%, the lowest in more that 50 years. Is that an impeachable event for your President?"
633,Donald Trump,"Gerry Baker of @WSJatLarge “Do you think what you’ve seen rises to the level of impeachment?” Ken Starr, Clinton S…"
634,Donald Trump,Sleepy Eyes Chuck Todd of “Meet the Press” had a total meltdown in his interview with highly reaspected Senator…
635,Donald Trump,"Join me at the Target Center in Minneapolis, Minnesota this Thursday, October 10th at 7:00pm! Tickets:…"
636,Donald Trump,"Good job, I must say, by Bob Woodward on “Deface the Nation.” The CBS no name host(ess), and other guest, Peter Bak…"
637,Donald Trump,Democrat lawyer is same for both Whistleblowers? All support Obama and Crooked Hillary. Witch Hunt!
638,Donald Trump,DRAIN THE SWAMP!
639,Donald Trump,"Will be in Minnesota on Thursday night. Massive response, crowd and enthusiasm (actually, all over the Country) wil…"
640,Donald Trump,
641,Donald Trump,
642,Donald Trump,"Going to Louisiana on Friday night for a big Republican Rally. Keep Democrat Governor Edwards under 50%, force a ru…"
643,Donald Trump,#DONOTHINGDEMOCRATS
644,Donald Trump,"....And by the way, I would LOVE running against 1% Joe Biden - I just don’t think it’s going to happen. Sleepy Joe…"
645,Donald Trump,"The Biden family was PAID OFF, pure and simple! The fake news must stop making excuses for something that is totall…"
646,Donald Trump,....and separately got 1.5 Billion Dollars from China despite no experience and for no apparent reason. There is NO…
647,Donald Trump,It is INCREDIBLE to watch and read the Fake News and how they pull out all stops to protect Sleepy Joe Biden and hi…
648,Donald Trump,"The Democrats are lucky that they don’t have any Mitt Romney types. They may be lousy politicians, with really bad…"
649,Donald Trump,95% Approval Rating in Republican Party. Thank you!
650,Donald Trump,The Do Nothing Democrats are being exposed!
651,Donald Trump,The great Scam is being revealed!
652,Donald Trump,
653,Donald Trump,
654,Donald Trump,
655,Donald Trump,"The first so-called second hand information “Whistleblower” got my phone conversation almost completely wrong, so n…"
656,Donald Trump,"“President Trump would be negligent if he did not bring this matter, Biden, up. If the V.P. of the U.S. is self enr…"
657,Donald Trump,Schiff and the Do Nothing Dems have lost all credibility...but the corrupt Media is working hard to keep them in th…
658,Donald Trump,"Mitt, get off the stage, you’ve had your turn (twice)!"
659,Donald Trump,"So Crooked Hillary Clinton can delete and acid wash 33,000 emails AFTER getting a Subpoena from the United States C…"
660,Donald Trump,"No Kevin, Jeff Flake is better!"
661,Donald Trump,"I’m hearing that the Great People of Utah are considering their vote for their Pompous Senator, Mitt Romney, to be…"
662,Donald Trump,"Not only are the Do Nothing Democrats interfering in the 2020 Election, but they are continuing to interfere in the…"
663,Donald Trump,
664,Donald Trump,"""Schiff is a FRAUD!"" @dbongino"
665,Donald Trump,THIS IS THE REAL STORY! @GreggJarrett
666,Donald Trump,"Mitt Romney never knew how to win. He is a pompous “ass” who has been fighting me from the beginning, except when h…"
667,Donald Trump,Somebody please wake up Mitt Romney and tell him that my conversation with the Ukrainian President was a congenial…
668,Donald Trump,"The so-called Whistleblower’s account of my perfect phone call is “way off,” not even close. Schiff and Pelosi neve…"
669,Donald Trump,The Media is “Fixed” and Corrupt. It bears no relationship to the truth. The @nytimes &amp; @washingtonpost are pure fi…
670,Donald Trump,"""NEW EXTREME DEMS NOW RUNNING THE PARTY!"""
671,Donald Trump,Thank you @KimStrassel and @AndrewCMcCarthy!
672,Donald Trump,SHIFTY SCHIFF DUPED BY RUSSIAN PRANKSTERS!
673,Donald Trump,
674,Donald Trump,Too bad!
675,Donald Trump,
676,Donald Trump,Thank you @robertjeffress!
677,Donald Trump,“Report: ‘Whistleblower’ Never Disclosed Contact with House Intel Panel to Inspector
678,Donald Trump,GREAT BOOK!
679,Donald Trump,“Pelosi Blatantly Lies During @GMA Interview About Schiff's Reading of Ukraine
680,Donald Trump,Where is the LameStream Media on this?
681,Donald Trump,Thanks Jim. Would be great to just run our Country!
682,Donald Trump,“Ex-Envoy testified Ukraine (or the President of Ukraine) never raised Quid Pro Quo concerns with him: source.”…
683,Donald Trump,"....of Ukraine, and cannot find any reason to charge the President with high crimes &amp; misdemeanors. This is just a…"
684,Donald Trump,"“It isn’t often I get angry at the dirty politics of the Democrats in Congress, but this time I am enraged and hope…"
685,Donald Trump,"Along with Pelosi and her boss AOC, the Do Nothing Democrat “leader.”"
686,Donald Trump,"Join me at the Target Center in Minneapolis, Minnesota next Thursday, October 10th at 7:00pm! Tickets:…"
687,Donald Trump,"My daughter Ivanka will be on @trish_regan tonight on @FoxBusiness at 8:00 P.M., following the great @LouDobbs at 7:00. Enjoy!"
688,Donald Trump,"....it to Congress, and the American people, as though it was the statement of the President of the United States,…"
689,Donald Trump,"“Adam Schiff’s connection to the Whistleblower is coming to light.” @FoxNews These facts, and others, make it impo…"
690,Donald Trump,LYIN’ SHIFTY SCHIFF!
691,Donald Trump,“When your making an unsubstantiated charge that the President of the United States is making a request having to d…
692,Donald Trump,
693,Donald Trump,I have just officially nominated Poland for entry into the Visa Waiver Program. With this decades long-awaited anno…
694,Donald Trump,"At the request of @SenThomTillis, I have declared a major disaster for the Great State of North Carolina to help wi…"
695,Donald Trump,"Under my Administration, Medicare Advantage premiums next year will be their lowest in the last 13 years. We are pr…"
696,Donald Trump,"WOW, this is big stuff!"
697,Donald Trump,“I think it’s outrages that a Whistleblower is a CIA Agent.”  Ed Rollins @FoxNews
698,Donald Trump,"“The witness was asked at least 20 times, and there definitely was no Quid Pro Quo.” @RepMarkMeadows @FoxNews The…"
699,Donald Trump,"“When your making an unsubstantiated statement that the President is making a claim having to do with quid pro quo,…"
700,Donald Trump,
701,Donald Trump,"The Whistleblower, who had the facts wrong about the phone call, reached out, and more, to the Democrat controlled…"
702,Donald Trump,"Breaking News: Unemployment Rate, at 3.5%, drops to a 50 YEAR LOW. Wow America, lets impeach your President (even t…"
703,Donald Trump,"As President I have an obligation to end CORRUPTION, even if that means requesting the help of a foreign country or…"
704,Donald Trump,"The Washington Times, “Ukraine envoy blows ‘massive hole’ into Democrat accusations. Republicans at hearing find no…"
705,Donald Trump,
706,Donald Trump,"Nancy Pelosi today, on @GMA, actually said that Adam Schiffty Schiff didn’t fabricate my words in a major speech be…"
707,Donald Trump,“They (Do Nothing Dems) are trying to nullify an election...” Joe diGenova
708,Donald Trump,"This isn’t about a Campaign, this is about Corruption on a massive scale!"
709,Donald Trump,"We are simultaneously fighting the Fake News Media and their partner, the Democrat Party. Always tough to beat the…"
710,Donald Trump,Great job Jim!
711,Donald Trump,AOC is a Wack Job!
712,Donald Trump,The Do Nothing Democrats don’t have time to get it done!
713,Donald Trump,Another big loss for the Do Nothing Dems!
714,Donald Trump,"As the President of the United States, I have an absolute right, perhaps even a duty, to investigate, or have inves…"
715,Donald Trump,"""...blowing MASSIVE holes inside of the theory, the narrative, that Chairman Schiff has been providing to the publi…"
716,Donald Trump,The Greatest Witch Hunt in the history of our Country!
717,Donald Trump,"Today at The Villages in Florida, it was my great honor to sign an Executive Order on protecting and improving Medi…"
718,Donald Trump,"“It was just a congenial phone call, but its become so big. I’ve never seen the Media work so hard with so little.”…"
719,Donald Trump,"Thank you @JennaEllisRives, really well done!"
720,Donald Trump,DRAIN THE SWAMP!
721,Donald Trump,“This is yet again an example of Democrats projecting THEIR criminal acts on President Trump. President Trump is an…
722,Donald Trump,“Trump Fundraising Haul Shows Impeachment Backfiring on Dems”
723,Donald Trump,There wasn’t ANYTHING said wrong in my conversation with the Ukrainian President. This is a Democrat Scam!
724,Donald Trump,Great time at The Villages in Florida today. Sorry we couldn’t get everybody in. I will be back soon!
725,Donald Trump,ELECTION INTERFERENCE!
726,Donald Trump,"95% Approval Rating in the Republican Party, and record setting fundraising that has taken place over the past two weeks. Thank you!"
727,Donald Trump,"Leader McCarthy, we look forward to you soon becoming Speaker of the House. The Do Nothing Dems don’t have a chance!"
728,Donald Trump,
729,Donald Trump,"Fake News, just like the snakes and gators in the moat. The Media is deranged, they have lost their minds!"
730,Donald Trump,Schiff is a lowlife who should resign (at least!).
731,Donald Trump,Schiff is a lying disaster for our Country. He should resign!
732,Donald Trump,The Republican Party has never had such support!
733,Donald Trump,Book is doing really well. A study in unfairness to a potentially great Justice!
734,Donald Trump,Thank you Hugh!
735,Donald Trump,A great book by a brilliant author. Buy it now!
736,Donald Trump,Great job Richard!
737,Donald Trump,Keep up the great work Kellie!
