,Name,Tweet
999,Donald Trump,“How many stories are wrong? Almost all of the stories the New York Times has done are inaccurate and wrong.”…
1000,Donald Trump,Congratulations @MarianoRivera!
1001,Donald Trump,"This afternoon at the @WhiteHouse, it was my great honor to present our nation’s highest civilian honor, the Presid…"
1002,Donald Trump,"Thank you, working hard! #KAG2020"
1003,Donald Trump,"Big crowd expected in New Mexico tonight, where we will WIN. Your Border Wall is getting stronger each and every da…"
1004,Donald Trump,"In a short while I will be presenting the New York @Yankees @MarianoRivera, the greatest relief pitcher (Closer!) o…"
1005,Donald Trump,....for the privilege of being your President - and doing the best job that has been done in many decades. I am far…
1006,Donald Trump,"They failed on the Mueller Report, they failed on Robert Mueller’s testimony, they failed on everything else, so no…"
1007,Donald Trump,“Democrats would rather talk about gun control than get something done.” Governor John Sununu @FoxNews @BillHemmer…
1008,Donald Trump,"Remember when Iran shot down a drone, saying knowingly that it was in their “airspace” when, in fact, it was nowher…"
1009,Donald Trump,Just Out: “Kavanaugh accuser doesn’t recall incident.” @foxandfriends DO YOU BELIEVE WHAT THESE HORRIBLE PEOPLE WI…
1010,Donald Trump,"“What’s happening to Justice Kavanaugh is a disgrace. This guy is not a good man, he is a great man. He has to go t…"
1011,Donald Trump,“The New York Times walks back report on Kavanaugh assault claim.” @foxandfriends The one who is actually being as…
1012,Donald Trump,"...The United States, because of the Federal Reserve, is paying a MUCH higher Interest Rate than other competing co…"
1013,Donald Trump,"Producer prices in China shrank most in 3 years due to China’s big devaluation of their currency, coupled with mone…"
1014,Donald Trump,"Because we have done so well with Energy over the last few years (thank you, Mr. President!), we are a net Energy E…"
1015,Donald Trump,".....’These Conservative Judicial appointments will impact our nation for years to come,’ said Lindsey Graham, Repu…"
1016,Donald Trump,"The @nytimes. “This week, the Senate passed a milestone in confirming the 150th Federal Judge of Mr. Trump’s Admini…"
1017,Donald Trump,"....work that way. I have a better idea. Look at the Obama Book Deal, or the ridiculous Netflix deal. Then look at…"
1018,Donald Trump,"House Judiciary has given up on the Mueller Report, sadly for them after two years and $40,000,000 spent - ZERO COL…"
1019,Donald Trump,“We cannot have what happened to this President happen again.” Joe DiGenova. “It is time for Justice to come barre…
1020,Donald Trump,"The Fake News is saying that I am willing to meet with Iran, “No Conditions.” That is an incorrect statement (as usual!)."
1021,Donald Trump,Here we go again with General Motors and the United Auto Workers. Get together and make a deal!
1022,Donald Trump,PLENTY OF OIL!
1023,Donald Trump,"Saudi Arabia oil supply was attacked. There is reason to believe that we know the culprit, are locked and loaded de…"
1024,Donald Trump,....sufficient to keep the markets well-supplied. I have also informed all appropriate agencies to expedite approva…
1025,Donald Trump,"Based on the attack on Saudi Arabia, which may have an impact on oil prices, I have authorized the release of oil f…"
1026,Donald Trump,"....Then, on top of it all, Kathleen Parker, of all people, wrote “In Case You Were Wondering, Trump Won The Debate…"
1027,Donald Trump,"Can’t believe the @washingtonpost wrote a positive front page story, “Unity Issue Has Parties Pointing To Trump. GO…"
1028,Donald Trump,"I am fighting the Fake (Corrupt) News, the Deep State, the Democrats, and the few remaining Republicans In Name Onl…"
1029,Donald Trump,Can’t let Brett Kavanaugh give Radical Left Democrat (Liberal Plus) Opinions based on threats of Impeaching him ove…
1030,Donald Trump,"Brett Kavanaugh should start suing people for libel, or the Justice Department should come to his rescue. The lies…"
1031,Donald Trump,Thank you @foxandfriends and @RepMarkMeadows. Great interview!
1032,Donald Trump,"Now the Radical Left Democrats and their Partner, the LameStream Media, are after Brett Kavanaugh again, talking lo…"
1033,Donald Trump,"All based on NOTHING! The Dems can’t get anything positive done, and probably don’t want to."
1034,Donald Trump,Thank you Billy!
1035,Donald Trump,Thank you!
1036,Donald Trump,My great honor!
1037,Donald Trump,"That is true, and the USA is Winning Again!"
1038,Donald Trump,Amazing!
1039,Donald Trump,"The Taliban has never been hit harder than it is being hit right now. Killing 12 people, including one great Americ…"
1040,Donald Trump,I’m OK with that!
1041,Donald Trump,....between our two countries. I look forward to continuing those discussions after the Israeli Elections when we m…
1042,Donald Trump,I had a call today with Prime Minister Netanyahu to discuss the possibility of moving forward with a Mutual Defense…
1043,Donald Trump,KEEP AMERICA GREAT!
1044,Donald Trump,MAKE AMERICA GREAT AGAIN!
1045,Donald Trump,94% Approval Rating in the Republican Party! Tuesday night in the Great State of North Carolina proved that high an…
1046,Donald Trump,"Who the hell is Joy-Ann Reid? Never met her, she knows ZERO about me, has NO talent, and truly doesn’t have the “it…"
1047,Donald Trump,“A Very Stable Genius!” Thank you.
1048,Donald Trump,"While I like the Vaping alternative to Cigarettes, we need to make sure this alternative is SAFE for ALL! Let’s get…"
1049,Donald Trump,Great news about the work we are doing on illegal immigration!
1050,Donald Trump,Historic Milestone indeed!
1051,Donald Trump,"The two big Congressional wins in North Carolina on Tuesday, Dan Bishop and Greg Murphy, have reverberated all over…"
1052,Donald Trump,"....VERY stupidly negotiated Trade Deals, and Illegal Immigration, are a tremendous cost and burden to our Country.…"
1053,Donald Trump,"Illegal Immigration costs the USA over 300 Billion Dollars a year. There is no reason for this, and things are bein…"
1054,Donald Trump,"....IG Report, which showed him to be a Disgraced &amp; Dirty Cop. Republicans have unified like never before. You don’…"
1055,Donald Trump,"....Became Number 1 in World &amp; Independent in Energy. Will soon have record number of Judges, 2 SC Justices. Done m…"
1056,Donald Trump,How do you impeach a President who has helped create perhaps the greatest economy in the history of our Country? Al…
1057,Donald Trump,Hello Baltimore!
1058,Donald Trump,"In fact, my views on Venezuela, and especially Cuba, were far stronger than those of John Bolton. He was holding me…"
1059,Donald Trump,“This should have been over with after the Mueller Report came out.” @guypbenson @FoxNews
1060,Donald Trump,"“We can’t beat him, so lets impeach him!” Democrat Rep. Al Green"
1061,Donald Trump,“Dems have never gotten over the fact that President Trump won the Election!” @GOPLeader McCarthy
1062,Donald Trump,Some really big Court wins on the Border lately!
1063,Donald Trump,It is expected that China will be buying large amounts of our agricultural products!
1064,Donald Trump,"European Central Bank, acting quickly, Cuts Rates 10 Basis Points. They are trying, and succeeding, in depreciating…"
1065,Donald Trump,Thank you Brandon!
1066,Donald Trump,Thank you!
1067,Donald Trump,"The Wall is going up very fast despite total Obstruction by Democrats in Congress, and elsewhere!"
1068,Donald Trump,The Wall is being built after victories against the Democrats in various courts!
1069,Donald Trump,....The Southern Border is becoming very strong despite the obstruction by Democrats not agreeing to do anything on Loopholes or Asylum!
1070,Donald Trump,"I had an excellent telephone conversation with Andrés Manuel López Obrador, President of Mexico, talking about Sout…"
1071,Donald Trump,"....on October 1st, we have agreed, as a gesture of good will, to move the increased Tariffs on 250 Billion Dollars…"
1072,Donald Trump,"At the request of the Vice Premier of China, Liu He, and due to the fact that the People's Republic of China will b…"
1073,Donald Trump,BIG United States Supreme Court WIN for the Border on Asylum!
1074,Donald Trump,"Today and every day, we pledge to honor our history, to treasure our liberty, to uplift our communities, to live up…"
1075,Donald Trump,Leaving the White House soon to speak at the Pentagon. My great honor!
1076,Donald Trump,"If it weren’t for the never ending Fake News about me, and with all that I have done (more than any other President…"
1077,Donald Trump,"....This is a phony suppression poll, meant to build up their Democrat partners. I haven’t even started campaigning…"
1078,Donald Trump,"In a hypothetical poll, done by one of the worst pollsters of them all, the Amazon Washington Post/ABC, which predi…"
1079,Donald Trump,....The USA should always be paying the the lowest rate. No Inflation! It is only the naïveté of Jay Powell and the…
1080,Donald Trump,"The Federal Reserve should get our interest rates down to ZERO, or less, and we should then start to refinance our…"
1081,Donald Trump,
1082,Donald Trump,"“China suspends Tariffs on some U.S. products. Being hit very hard, supply chains breaking up as many companies mov…"
1083,Donald Trump,"Greg Murphy won big, 62% to 37%, in North Carolina 03, &amp; the Fake News barely covered the race. The win was far big…"
1084,Donald Trump,Alice @alicetweet Stewart: Thank you for the nice words while on @CNN concerning the TWO big Republican Congression…
1085,Donald Trump,
1086,Donald Trump,".@CNN &amp; @MSNBC were all set to have a BIG victory, until Dan Bishop won North Carolina 09. Now you will hear them b…"
1087,Donald Trump,BIG NIGHT FOR THE REPUBLICAN PARTY. CONGRATULATIONS TO ALL!
1088,Donald Trump,Greg Murphy is a big winner in North Carolina 03. Much bigger margins than originally anticipated. Congratulations Greg!
1089,Donald Trump,"Dan Bishop was down 17 points 3 weeks ago. He then asked me for help, we changed his strategy together, and he ran…"
1090,Donald Trump,"Senator Ben Sasse has done a wonderful job representing the people of Nebraska. He is great with our Vets, the Mili…"
1091,Donald Trump,"I am pleased to endorse Governor Mike Parson of Missouri. He is very Popular, Strong, and knows what he is doing –…"
1092,Donald Trump,Excellent interview by @CondoleezzaRice on @MarthaMaccallum on @FoxNews. Very interesting and secure perspective on life.
1093,Donald Trump,"One down, one to go – Greg Murphy is projected to win in the Great State of North Carolina! #NC03"
1094,Donald Trump,Incredible progress being made at the Southern Border!
1095,Donald Trump,"....I asked John for his resignation, which was given to me this morning. I thank John very much for his service. I…"
1096,Donald Trump,I informed John Bolton last night that his services are no longer needed at the White House. I disagreed strongly w…
1097,Donald Trump,Vote today for Dan Bishop. Will be great for North Carolina and our Country!
1098,Donald Trump,One of the greatest and most powerful weapons used by the Fake and Corrupt News Media is the phony Polling Informat…
1099,Donald Trump,ABC/Washington Post Poll was the worst and most inaccurate poll of any taken prior to the 2016 Election. When my la…
1100,Donald Trump,"NORTH CAROLINA, VOTE FOR DAN BISHOP TODAY. WE NEED HIM BADLY IN WASHINGTON!"
1101,Donald Trump,Last night in North Carolina was incredible!
1102,Donald Trump,Great job by the U.S. Coast Guard!
1103,Donald Trump,THANK YOU @USCG! GREAT JOB!!
1104,Donald Trump,Beautiful evening in Fayetteville tonight! Big day in North Carolina tomorrow. Make sure you get out and VOTE for D…
1105,Donald Trump,"THANK YOU Fayetteville, North Carolina! Make sure you get out and VOTE TOMORROW for Dan Bishop in #NC09 and Greg Mu…"
1106,Donald Trump,NORTH CAROLINA — Vote for Dan Bishop in #NC09 and Greg Murphy in #NC03 TOMORROW. Make it a great day for Republicans!
1107,Donald Trump,"Received an update on Air Force One at MCAS Cherry Point in North Carolina, regarding damage caused by Hurricane Do…"
1108,Donald Trump,"Departing MCAS Cherry Point in North Carolina for Fayetteville, North Carolina. This is amazing!"
1109,Donald Trump,Speaking to Governor @HenryMcMaster of South Carolina on my way to North Carolina for a big rally for Dan Bishop (…
1110,Donald Trump,To every one of the HEROES we recognized today — THANK YOU and God Bless You All!
1111,Donald Trump,"We have been serving as policemen in Afghanistan, and that was not meant to be the job of our Great Soldiers, the f…"
1112,Donald Trump,"...the Economy, where there is NO Recession, much to the regret of the LameStream Media! They are working overtime…"
1113,Donald Trump,"...the look of turmoil in the White House, of which there is none. I view much of the media as simply an arm of the…"
1114,Donald Trump,A lot of Fake News is being reported that I overruled the VP and various advisers on a potential Camp David meeting…
1115,Donald Trump,The Trump Administration has achieved more in the first 2 1/2 years of its existence than perhaps any administratio…
1116,Donald Trump,I had nothing to do with the decision of our great @VP Mike Pence to stay overnight at one of the Trump owned resor…
1117,Donald Trump,I know nothing about an Air Force plane landing at an airport (which I do not own and have nothing to do with) near…
1118,Donald Trump,"..that this Administration has done. They don’t talk about the great economy, the big tax and regulation cuts, the…"
1119,Donald Trump,"As bad as @CNN is, Comcast MSNBC is worse. Their ratings are also way down because they have lost all credibility.…"
1120,Donald Trump,"...But most importantly, @CNN is bad for the USA. Their International Division spews bad information &amp; Fake News al…"
1121,Donald Trump,"Great news that an activist investor is now involved with AT&amp;T. As the owner of VERY LOW RATINGS @CNN, perhaps they…"
1122,Donald Trump,"94% Approval Rating in the Republican Party, a record. Thank you!"
1123,Donald Trump,"House Republicans should allow Chairs of Committees to remain for longer than 6 years. It forces great people, and…"
1124,Donald Trump,"...but then he ran for Congress and won, only to lose his re-elect after I Tweeted my endorsement, on Election Day,…"
1125,Donald Trump,"When the former Governor of the Great State of South Carolina, @MarkSanford, was reported missing, only to then say…"
1126,Donald Trump,"North Carolina, vote for Dan Bishop tomorrow. We need him badly in Washington! His opponent is a far left Sanctuary Cities supporter."
1127,Donald Trump,Maria &amp; John understood the dishonesty &amp; deception from the very beginning!
1128,Donald Trump,".....the importance or passage of Criminal Justice Reform. They only talk about the minor players, or people that h…"
1129,Donald Trump,"....musician @johnlegend, and his filthy mouthed wife, are talking now about how great it is - but I didn’t see the…"
1130,Donald Trump,"....A man named @VanJones68, and many others, were profusely grateful (at that time!). I SIGNED IT INTO LAW, no one…"
1131,Donald Trump,When all of the people pushing so hard for Criminal Justice Reform were unable to come even close to getting it do…
1132,Donald Trump,
1133,Donald Trump,"Congratulations to @JudgeJeanine Pirro on having, again, the Number One Best Selling Book!"
1134,Donald Trump,"Looking forward to being in the North Carolina tomorrow night. We’re having a BIG RALLY for a great guy, Dan Bishop…"
1135,Donald Trump,WE ARE BUILDING THE WALL...
1136,Donald Trump,Leakin’ Lyin’ James Comey!
1137,Donald Trump,
1138,Donald Trump,"....only made it worse! If they cannot agree to a ceasefire during these very important peace talks, and would even…"
1139,Donald Trump,"....an attack in Kabul that killed one of our great great soldiers, and 11 other people. I immediately cancelled th…"
1140,Donald Trump,"Unbeknownst to almost everyone, the major Taliban leaders and, separately, the President of Afghanistan, were going…"
1141,Donald Trump,"...FAKE NEWS. I would like very much to stop referring to this ridiculous story, but the LameStream Media just won’…"
1142,Donald Trump,"The Failing New York Times stated, in an article written by Obama flunky Peter Baker (who lovingly wrote Obama book…"
1143,Donald Trump,Our Economy is doing great!!!!!
1144,Donald Trump,"JOBS, JOBS, JOBS!"
1145,Donald Trump,Congratulations to the GREAT Jerry West! https://t.co/BD6FUD6JwP
1146,Donald Trump,Thank you Katie. The U.S. is doing great!
1147,Donald Trump,"Russia and Ukraine just swapped large numbers of prisoners. Very good news, perhaps a first giant step to peace. Co…"
1148,Donald Trump,"“In 22 years of patrolling our Southern Border, I have never seen Mexico act like a true Border Security Partner un…"
1149,Donald Trump,"The Washington Post’s @PhilipRucker (Mr. Off the Record) &amp; @AshleyRParker, two nasty lightweight reporters, shouldn…"
1150,Donald Trump,I want to congratulate @senatemajldr Mitch McConnell and all Republicans. Today I signed the 160th Federal Judge to…
1151,Donald Trump,"....I would also like to thank “Papa” Doug Manchester, hopefully the next Ambassador to the Bahamas, for the incred…"
1152,Donald Trump,Thank you to Bahamian Prime Minister Hubert Minnis for your very gracious and kind words in saying that without the…
1153,Donald Trump,"China just enacted a major stimulus plan. With all the Tariffs THEY are paying to the USA, Billions and Billions of…"
1154,Donald Trump,"PROMISES MADE, PROMISES KEPT!"
1155,Donald Trump,
1156,Donald Trump,....that were not hit – and that are in good condition. Any cruise ship companies willing to act as stationary hous…
1157,Donald Trump,"The @USCG, @FEMA, and all others, along with other countries that have been helping, have been asked to move people…"
1158,Donald Trump,“The Washington Post’s Lost Summer”
1159,Donald Trump,
1160,Donald Trump,
1161,Donald Trump,“China is eating the Tariffs.” Billions pouring into USA. Targeted Patriot Farmers getting massive Dollars from the…
1162,Donald Trump,The Economy is great. The only thing adding to “uncertainty” is the Fake News!
1163,Donald Trump,"Great job by FEMA, Law Enforcement, First Responders, U.S. Coast Guard, and ALL! Keep going, we all appreciate what you are doing!"
1164,Donald Trump,....partner should start playing it straight. It would be so much better for our Country!
1165,Donald Trump,"....This nonsense has never happened to another President. Four days of corrupt reporting, still without an apology…"
1166,Donald Trump,"The Fake News Media was fixated on the fact that I properly said, at the beginnings of Hurricane Dorian, that in ad…"
1167,Donald Trump,Larry Kudlow on @Varneyco now!
1168,Donald Trump,Our great @JudgeJeanine has just written a book that will add to the tremendous success of her last number one best…
1169,Donald Trump,Great interview of Sarah Sanders by @foxandfriends. She is a terrific person with a great future!
1170,Donald Trump,Congratulations to @edhenry and his sister on a great success. What a wonderful thing to do!
1171,Donald Trump,"I agree with @jimcramer, the Fed should lower rates. They were WAY too early to raise, and Way too late to cut - an…"
1172,Donald Trump,DACA will be going before the Supreme Court. It is a document that even President Obama didn’t feel he had the lega…
1173,Donald Trump,"....President Obama never had the legal right to sign DACA, and he indicated so at the time of signing. But In any…"
1174,Donald Trump,....have the discretion to end the program that President Obama began in his discretion. That program was unlawful…
1175,Donald Trump,"The Immigration Law Institute’s Christopher Hajec says, “The Supreme Court has to look st whether DACA is lawful. W…"
1176,Donald Trump,"....that our economy is very strong. If the Fed would lower rates to where the bond market says they should be, the…"
1177,Donald Trump,"“I think President Trump is set in his ways because he doesn’t see any weakening. I mean, look at the joblessness r…"
1178,Donald Trump,"Looking forward to watching @SarahHuckabee Sanders tomorrow morning on @FoxandFriends, by far the #1 rated show on…"
1179,Donald Trump,"Great job done by @GovRonDesantis, @SenRickScott, Senator @MarcoRubio, and all of the those from Florida that were…"
1180,Donald Trump,Just got off the phone with Governor Brian Kemp (@GovKemp) of Georgia. Happy to hear that things are looking good f…
1181,Donald Trump,Just spoke to Governor @HenryMcMaster of South Carolina regarding Hurricane Dorian. I informed Henry that we are mo…
1182,Donald Trump,Just talked to Governor Roy Cooper of North Carolina as Hurricane Dorian ominously comes up the East Coast. We are…
1183,Donald Trump,I was with you all the way Alabama. The Fake News Media was not!
1184,Donald Trump,"Just as I said, Alabama was originally projected to be hit. The Fake News denies it!"
1185,Donald Trump,....His dedication to Israel and to seeking peace between Israel and the Palestinians won’t be forgotten. He will b…
1186,Donald Trump,"After almost 3 years in my Administration, Jason Greenblatt will be leaving to pursue work in the private sector. J…"
1187,Donald Trump,Really Good Jobs Numbers!
1188,Donald Trump,"Alabama was going to be hit or grazed, and then Hurricane Dorian took a different path (up along the East Coast). T…"
1189,Donald Trump,"....said what she did, even being on a much higher rated show, she would have been thrown off television. Will Fake…"
1190,Donald Trump,"Bad “actress” Debra The Mess Messing is in hot water. She wants to create a “Blacklist” of Trump supporters, &amp; is b…"
1191,Donald Trump,"....Instead it turned North and went up the coast, where it continues now. In the one model through Florida, the Gr…"
1192,Donald Trump,"In the early days of the hurricane, when it was predicted that Dorian would go through Miami or West Palm Beach, ev…"
1193,Donald Trump,Thank you Rad - looking great!
1194,Donald Trump,Thank you Terrence. Best Employment Numbers In History for African Americans!
1195,Donald Trump,
1196,Donald Trump,"....information does come out.” Charlie Hurt, Washington Times  @LouDobbs"
1197,Donald Trump,"....facts, and that should terrify every American regardless of their political stripe. The idea that all of that i…"
1198,Donald Trump,“Absolutely nothing is more important than going back &amp; getting to the bottom of the origins of the investigation.…
1199,Donald Trump,"This was the originally projected path of the Hurricane in its early stages. As you can see, almost all models pred…"
1200,Donald Trump,"State Rep Greg Murphy is running for Congress in North Carolina, District 3. We really need Greg in Washington. He…"
1201,Donald Trump,"7. The badly flawed Paris Climate Agreement protects the polluters, hurts Americans, and cost a fortune. NOT ON MY…"
1202,Donald Trump,6. The Democrats’ destructive “environmental” proposals will raise your energy bill and prices at the pump. Don't…
1203,Donald Trump,4. The U.S. now leads the world in energy production...BUT... 5. Who's got the world's cleanest and safest air and water? AMERICA!
1204,Donald Trump,1. Which country has the largest carbon emission reduction?AMERICA!2. Who has dumped the most carbon into the a…
1205,Donald Trump,8 FACTS that #FakeNewsCNN will ignore in tonight’s “Climate Forum”
1206,Donald Trump,"....We can’t have a system where we run our entire economy for the benefit of other countries, which have long char…"
1207,Donald Trump,....Trump is doing to China is not lost on the rest of the world. Europe has had among the most protectionist polic…
1208,Donald Trump,"“The Chinese are very adept at not accepting anything. You’ve got to be very tough, and that’s what Trump is doing.…"
1209,Donald Trump,“U.S. Winning Trade War With China In Dollars.” CNBC
1210,Donald Trump,.....on the President of the United States.” @charliekirk11 @trish_regan
1211,Donald Trump,"“To declassify is so important because if this were a Democrat President or a Democrat Candidate, that was spied on…"
1212,Donald Trump,“I am so tired of hearing the rationalization of the Left in the country because they hate Donald Trump. Inexplicab…
1213,Donald Trump,The truth is that we have a nation that is disgusted with the FBI. We have a crisis of confidence in the number one…
1214,Donald Trump,"At the request of Senator Thom Tillis, I am getting the North Carolina Emergency Declaration completed and signed t…"
1215,Donald Trump,"The U.S. may be getting a little bit lucky with respect to Hurricane Dorian, but please don’t let down your guard.…"
1216,Donald Trump,@NHC_Atlantic
1217,Donald Trump,"....”knife crime,” which is totally out of control in London. People are afraid to even walk the streets. He is a t…"
1218,Donald Trump,"The incompetent Mayor of London, Sadiq Khan, was bothered that I played a very fast round of golf yesterday. Many P…"
1219,Donald Trump,"Based on the IG Report, the whole Witch Hunt against me and my administration was a giant and illegal SCAM. The Hou…"
1220,Donald Trump,"Germany, and so many other countries, have negative interest rates, “they get paid for loaning money,” and our Fede…"
1221,Donald Trump,"For all of the “geniuses” out there, many who have been in other administrations and “taken to the cleaners” by Chi…"
