,Name,Tweet
1294,Barack Obama,LIVE: President Obama is honoring veterans at Arlington National Cemetery. https://t.co/IZgdqYxNZ2 #VeteransDay
1295,Barack Obama,ICYMI: The unemployment rate is now at a seven-year low.
1296,Barack Obama,Make sure to check this off your list: https://t.co/obg1pKy0Bk #GetCovered
1297,Barack Obama,President Obama explains why the #TPP is good for American workers and the middle class:
1298,Barack Obama,"""I'm going to keep on going as long as you'll have me."" —President Obama to @OFA volunteers #OFAFallSummit"
1299,Barack Obama,"""I need you to stay involved. I need you to stay active."" —President Obama #OFAFallSummit"
1300,Barack Obama,"""I may only hold this office for the next 14 months, but I'm not going anywhere."" —President Obama #OFAFallSummit"
1301,Barack Obama,"""When the cynics tell us we can't change this country for the better, we know they're wrong. We've got proof."" —President Obama"
1302,Barack Obama,"""We've still got our work cut out for us to fix the broken immigration system."" —President Obama #OFAFallSummit"
1303,Barack Obama,"""Your organizing skills are more important than ever.""—President Obama #OFAFallSummit"
1304,Barack Obama,"""You know we've got more work to do. You wouldn't be here if you didn't think we have more work to do.""—President Obama #OFAFallSummit"
1305,Barack Obama,"""Even as our economy is growing, America's cut our carbon pollution more than any other advanced nation on Earth."" —President Obama"
1306,Barack Obama,"""We've covered 17.6 million Americans so far, and in the process the deficit's been cut by two-thirds."" —President Obama #OFAFallSummit"
1307,Barack Obama,"""We've seen the longest streak of private-sector job creation on record—that happened because of you."" —President Obama #OFAFallSummit"
1308,Barack Obama,"""You figure out what's important in your communities and you organize around it.""—President Obama at the #OFAFallSummit"
1309,Barack Obama,"""You be the change you want to come about.""—President Obama #OFAFallSummit"
1310,Barack Obama,"""Together, we created a movement for change that couldn't be denied.""—President Obama #OFAFallSummit"
1311,Barack Obama,"""It's always good to be with OFA. It's a little bit like coming home.""—President Obama #OFAFallSummit"
1312,Barack Obama,LIVE: President Obama is speaking to @OFA volunteers at the #OFAFallSummit.
1313,Barack Obama,"""It was never about yes he can—it was about yes we can."" —@Simas44 #OFAFallSummit"
1314,Barack Obama,"""For the first time, more than 90% of Americans are covered."" —President Obama https://t.co/oEk3RYamsm #GetCovered"
1315,Barack Obama,"In the weekly address, President Obama discusses why it's so important to #GetCovered:"
1316,Barack Obama,Retweet if you support American leadership on climate change. #ActOnClimate
1317,Barack Obama,The President just rejected #KeystoneXL. Add your name to support strong action on climate change: https://t.co/UQ4n60s4fw #ActOnClimate
1318,Barack Obama,"""If we want to prevent the worst effects of climate change before it's too late, the time to act is now."" —President Obama #ActOnClimate"
1319,Barack Obama,"""Shipping crude oil into our country would not increase America's energy security."" —President Obama #KeystoneXL"
1320,Barack Obama,"""Today, in 41 states, drivers can find at least one gas station selling gas for less than $2 a gallon."" —President Obama #KeystoneXL"
1321,Barack Obama,"""In fact, gas prices have already been falling, steadily."" —President Obama on rejecting the #KeystoneXL"
1322,Barack Obama,"""The pipeline would not lower gas prices for American consumers."" —President Obama on rejecting the #KeystoneXL"
1323,Barack Obama,"""If Congress is serious about wanting to create jobs, this was not the way to do it."" —President Obama on rejecting the #KeystoneXL"
1324,Barack Obama,"""The pipeline would not make a meaningful, long-term contribution to our economy."" —President Obama on rejecting the #KeystoneXL"
1325,Barack Obama,BREAKING: President Obama just took another huge step to #ActOnClimate by rejecting the #KeystoneXL pipeline.
1326,Barack Obama,LIVE: President Obama is delivering a statement.
1327,Barack Obama,"The economy added 271,000 jobs in October—a record-breaking 68 consecutive months of private-sector job growth."
1328,Barack Obama,"The #TPP eliminates 18,000 taxes that other countries put on American goods. https://t.co/VMPIrGn2Mf #LeadOnTrade"
1329,Barack Obama,More American-made exports means more higher-paying jobs at home: https://t.co/FNGnIEzgUx #TPP
1330,Barack Obama,"""When we have a level playing field, Americans out-compete anyone in the world."" —President Obama https://t.co/xShwzu6OQF #LeadOnTrade"
1331,Barack Obama,"Negotiations on the #TPP are complete, and the full text is now available online. Find out more: https://t.co/A6WiTdMOXp #LeadOnTrade"
1332,Barack Obama,More than two dozen states and cities are fighting to #ActOnClimate by defending the Clean Power Plan:
1333,Barack Obama,Finding a plan that fits your needs is easy. Check out your options and #GetCovered: https://t.co/1McmRF5opi
1334,Barack Obama,A vocal minority could still derail the bipartisan budget deal—don't let that happen. Show your support:
1335,Barack Obama,"Get an update on issues that matter, from gun violence prevention to health care enrollment:"
1336,Barack Obama,The marketplace is open again—shop around and find a plan that works for you: https://t.co/HeXYqOqu2g #GetCovered
1337,Barack Obama,Working hard in America shouldn't mean choosing between a paycheck and a sick kid at home. #LeadOnLeave
1338,Barack Obama,LIVE: President Obama is speaking about the re-entry process of formerly incarcerated individuals.
1339,Barack Obama,Tune in at 4:20 p.m. ET to watch President Obama speak on rehabilitation and reintegration: https://t.co/X1CmRvumbO #CriminalJusticeReform
1340,Barack Obama,Here's what happened when 35 passionate student organizers came together to learn how to improve their impact:
1341,Barack Obama,"Under #Obamacare, the uninsured rate in the United States is at the lowest level on record."
1342,Barack Obama,Nearly 8 in 10 uninsured Americans may be eligible for financial help. Check out your options: https://t.co/mJtVbt1ba5 #GetReadyGetCovered
1343,Barack Obama,Open enrollment is back: https://t.co/DCGSKXPVzi #GetReadyGetCovered
1344,Barack Obama,Post Halloween checklist:Coffee: ✓Brunch: ✓Health insurance:
1345,Barack Obama,The health care marketplace is open again. Check out your options now: https://t.co/osU8GUFSIu #GetCovered
1346,Barack Obama,Don't miss your chance to #GetCovered: https://t.co/pOS2uGg8f9
1347,Barack Obama,Trick-or-treat? #HappyHalloween
1348,Barack Obama,Make sure you #GetCovered tomorrow—before you eat too much Halloween candy.
1349,Barack Obama,"""Every year, we spend $80 billion in taxpayer dollars to keep people incarcerated."" —President Obama"
1350,Barack Obama,"In the weekly address, President Obama calls for meaningful criminal justice reform:"
1351,Barack Obama,Don't miss it. #GetCovered
1352,Barack Obama,Watch as President Obama and @FLOTUS welcome children to trick-or-treat at the White House: https://t.co/SXmz119b8h
1353,Barack Obama,Passionate student organizers came together at @OFA's Campus Organizing Summit. Find out more:
1354,Barack Obama,"DYK: Under #Obamacare, millions of young adults are able to remain on their parents' plans until they turn 26."
1355,Barack Obama,"""I applaud the Democrats and Republicans who came together this morning to pass a responsible, long-term budget agreement."" —President Obama"
1356,Barack Obama,Spread the word: There are nearly 10.5 million uninsured Americans who may be eligible to #GetCovered in 2016.
1357,Barack Obama,Read @ShaunOMB's op-ed on how science and data are helping the U.S. focus on the long-term costs of climate change:
1358,Barack Obama,Big polluters and climate change deniers are standing in the way of progress—fight back: https://t.co/Suca7L4Qer
1359,Barack Obama,17.6 million Americans have gained coverage under #Obamacare—that’s a BFD.
1360,Barack Obama,Don't let climate change deniers have the final say on the Clean Power Plan—show your support: https://t.co/WonJQaG13f #ActOnClimate
1361,Barack Obama,Open enrollment is right around the corner. #GetCovered
1362,Barack Obama,"If you want cleaner air and improved public health, add your name: https://t.co/7ke9LaRf8m #ActOnClimate"
1363,Barack Obama,America's mayors are calling for Congress to #DoSomething about gun violence.
1364,Barack Obama,Retweet to spread the word. #GetCovered
1365,Barack Obama,LIVE: President Obama is speaking at the International Association of Chiefs of Police Conference and Exposition.
1366,Barack Obama,"At 3 p.m. ET, watch President Obama address the International Association of Chiefs of Police in Chicago:"
1367,Barack Obama,LIVE: President Obama is welcoming the @ussoccer_wnt to celebrate their World Cup victory. https://t.co/BEInPfugzi #SheBelieves
1368,Barack Obama,New federal limits on methane pollution will help make our air cleaner. Show your support: https://t.co/x1MOB932DC #ActOnClimate
1369,Barack Obama,"""We've led by example, generating more clean energy and lowering our carbon emissions."" —President Obama"
1370,Barack Obama,This is why the Clean Power Plan matters. #ActOnClimate
1371,Barack Obama,LIVE: President Obama is hosting a panel at the White House on criminal justice reform.
1372,Barack Obama,Organizers in New Mexico are working to make sure people in their communities have affordable care. Read how:
1373,Barack Obama,LIVE: President Obama is in West Virginia hosting a community discussion on drug abuse.
1374,Barack Obama,Tune in at 2:20 p.m. ET to watch President Obama host a community forum on drug abuse.
1375,Barack Obama,A new poll shows that a majority of Americans want common-sense laws on gun sales: https://t.co/0e2OTdy6EV #DoSomething
1376,Barack Obama,Action on climate change can't wait—which is why the Clean Power Plan is so important.
1377,Barack Obama,Eighty-one companies support a global agreement to #ActOnClimate:
1378,Barack Obama,ICYMI: Yesterday marked the official adoption of the #IranDeal:
1379,Barack Obama,Diali came to @OFA to develop her digital content production skills and continue a career in organizing. Read more: http://t.co/A7Hi4BWz6e
1380,Barack Obama,"""The United States is home to 5% of the world’s population, but 25% of the world’s prisoners."" —President Obama http://t.co/TIkMUi58f5"
1381,Barack Obama,"In the weekly address, President Obama discusses the steps needed to fix our criminal justice system. http://t.co/TIkMUi58f5"
1382,Barack Obama,Retweet if you agree it's time to #ActOnClimate. http://t.co/ku22tRSWal
1383,Barack Obama,Coal mining companies are supporting an international deal to #ActOnClimate: http://t.co/dbGikYvJYF It's time for deniers to get on board.
1384,Barack Obama,"Under the Obama administration, the deficit is down nearly 75 percent—the lowest it's been since 2007. http://t.co/3LCue7Fe7s"
1385,Barack Obama,Add your name to the thousands of people asking Congress to stand up and #DoSomething about gun violence: http://t.co/S2Y1Mk6iWK
1386,Barack Obama,LIVE: President Obama is speaking at a celebration of Hispanic Heritage Month. http://t.co/E1PA8AZUDS
1387,Barack Obama,Tune in at 4:45 p.m. ET to watch President Obama speak at an event celebrating Hispanic Heritage Month. http://t.co/GXwTQgKqnG
1388,Barack Obama,See where your representatives stand on the basic science of climate change: http://t.co/ElYb0YIG73 #ActOnClimate
1389,Barack Obama,Climate change denial is at a record low—just not in Congress. Read more: http://t.co/0sVnLm05NQ #ActOnClimate
1390,Barack Obama,Make your sweet tooth happy—it's #NationalDessertDay. http://t.co/L7GnDIUO3c
1391,Barack Obama,Hundreds of organizers recently gathered in New Mexico to celebrate progress on health care reform. Read more: http://t.co/k89X7zL294
1392,Barack Obama,Another reason why it's so important to #ActOnClimate: http://t.co/XsCMTXEWdT
1393,Barack Obama,Read why @GovEdRendell thinks #TPP will be good for manufacturing and boost products #MadeInAmerica: http://t.co/qJJO4ShVUs
1394,Barack Obama,Former Washington Governor Christine Gregoire on why the #TPP will help protect the environment: http://t.co/o6zeYoOKFp
1395,Barack Obama,Expanding Medicaid isn't just practical—it's the right thing to do. http://t.co/RDg6nz8nnF #PeopleOverPolitics
1396,Barack Obama,Repealing #Obamacare is still a bad idea. http://t.co/pBGjtIKc59
1397,Barack Obama,Keep the conversation on gun violence going until Congress will #DoSomething about it: http://t.co/A96eAymD37
1398,Barack Obama,"""Outdated trade rules put our workers at a disadvantage—and TPP will change that."" —President Obama http://t.co/mrdFZvoETy #TPP"
1399,Barack Obama,"In the weekly address, President Obama discusses how the #TPP will put American workers first. http://t.co/mrdFZvoETy"
1400,Barack Obama,Wind and solar energy are getting cheaper and cheaper—the #SwitchToClean energy is happening. http://t.co/nzigk15vXp
1401,Barack Obama,Add your name to the list of people asking Congress to #DoSomething about gun violence: http://t.co/Ff6P4JyV9Y
1402,Barack Obama,Check out how these @OFA volunteers are making a difference on gun violence in their community: http://t.co/0lAwbcKo7D #DoSomething
1403,Barack Obama,Retweet if you agree: It's time for Congress to put politics aside and #DoSomething about gun violence. http://t.co/TaInIBmrhG
1404,Barack Obama,Our thoughts and prayers are not enough. It's time for Congress to #DoSomething to prevent gun violence tragedies: http://t.co/TMWUhGgsXK
1405,Barack Obama,"""This will not change until the politics change."" —President Obama on gun violence #DoSomething http://t.co/kqz7WIShnh"
1406,Barack Obama,Take a look at some of the most important recent stories on gun violence prevention: http://t.co/02cXehbVvi #DoSomething
1407,Barack Obama,Add your name if you agree it's time for Congress to #DoSomething about gun violence in America. http://t.co/ttnwvksW10
1408,Barack Obama,LIVE: President Obama is speaking at the @WhiteHouse Summit on Worker Voice. http://t.co/Fnr99d1D7q
1409,Barack Obama,An @OFA volunteer reflects on the trainings she received—that helped her land her dream job. http://t.co/YABvrFllkR
1410,Barack Obama,Stand up for American workers—add your name if you agree it's time to #LeadOnTrade. http://t.co/YBluIYLipw
1411,Barack Obama,The #TPP establishes the highest labor standards of any trade agreement in history. http://t.co/3vqoancyYp
1412,Barack Obama,"The more U.S. goods sold abroad, the more higher-paying jobs are supported at home—another reason to #LeadOnTrade: http://t.co/P2Gl6w6R1Z"
1413,Barack Obama,"""I refuse to leave our children a planet that's beyond their capacity to repair."" —President Obama #OurOcean2015"
1414,Barack Obama,Add your name to support the most progressive trade deal in this nation's history: http://t.co/DPx1onQXmm #LeadOnTrade
1415,Barack Obama,Great news: President Obama just secured a trade deal that puts American workers first. http://t.co/lYI3qRClX6 #LeadOnTrade
1416,Barack Obama,Twenty-three years and still going strong. Here's to many more. #HappyAnniversary http://t.co/EdEvqUF0s7
1417,Barack Obama,"""Congress should do its job, stop kicking the can down the road, and pass a serious budget."" —President Obama http://t.co/HsE9QjkfLD"
1418,Barack Obama,"In the weekly address, President Obama urges Congress to pass a real budget. http://t.co/HsE9QjkfLD"
1419,Barack Obama,Private-sector jobs have grown for a record-breaking 67 straight months—but there's more to do.
1420,Barack Obama,"More than 10,000 people die from gun violence in the U.S. each year—that can change. http://t.co/Oi80sA6qJD http://t.co/iguwO9P5dh"
1421,Barack Obama,Our thoughts and prayers are not enough—it's time to take action. http://t.co/qfEm0j9r3V
1422,Barack Obama,Organizers across the country are working to prevent gun violence—state by state. Read more: http://t.co/DpnWBhEJcc
1423,Barack Obama,LAST CALL: Enter for a chance to meet President Obama. http://t.co/0s2pXZGsI0 http://t.co/cbSaQVR4SO
1424,Barack Obama,DEADLINE: Tonight. Time to make your move—chip in now. http://t.co/AjKnE79V5V http://t.co/fwz6HYAmqw
1425,Barack Obama,This is your chance to meet President Obama. (No joke.) http://t.co/wrjKnubpxY http://t.co/EoSWsROzjY
1426,Barack Obama,You and a guest could fly to D.C. and meet the President. Enter now for your chance: http://t.co/k3VB2JxQAg
1427,Barack Obama,Give this grassroots movement a lift—become a recurring donor today: http://t.co/90E4s8MZth http://t.co/fFsIi3uHLc
1428,Barack Obama,Enter before midnight and you—and your BFF—could meet the President this fall. http://t.co/XjtDaGWXno http://t.co/hRrMiIawHe
1429,Barack Obama,Better hurry—the deadline to show your support for this grassroots movement is tonight. http://t.co/n8C7rdD4s0 http://t.co/GHxzFc8rTC
1430,Barack Obama,Want to hear that laugh in person? Throw your name in before tonight's deadline: http://t.co/XZkI1GSUg9 http://t.co/bgzegZCDDU
1431,Barack Obama,Enter now and you could meet President Obama in D.C. this fall: http://t.co/HDxcIuds0r
1432,Barack Obama,Coffee: √Fall sweater: √Meeting the President: ?Enter before #NationalCoffeeDay ends: http://t.co/S6F8APNINk http://t.co/6HdX6i20kg
1433,Barack Obama,"Chip in to fight for real, lasting change: http://t.co/OKJKKxfDIi http://t.co/qq6zlVWWeG"
1434,Barack Obama,Give it your best shot—enter today for your chance to meet the President: http://t.co/jXBu09fx7F http://t.co/VRgaDL2FQu
1435,Barack Obama,"In an interview with @RollingStone, President Obama lays out why we need to #ActOnClimate before it's too late. http://t.co/gMyOuzHcNM"
1436,Barack Obama,This movement started with grassroots supporters just like you. Help keep it going—chip in $5 or more today: http://t.co/L5qG329kPg
1437,Barack Obama,Watch a #VICEonHBO clip about President Obama's historic visit to a federal prison: http://t.co/rn8up4iCE5
1438,Barack Obama,Don't miss the chance to meet President Obama this fall—all you have to do is enter: http://t.co/5uTwJE8jiX
1439,Barack Obama,Want to be the one walking through that door? Enter the contest now: http://t.co/CZs9v11xTo http://t.co/ip7vt2AyhT
1440,Barack Obama,Beat the buzzer—the big fundraising deadline is almost here. http://t.co/LwzgniHTi7 http://t.co/pBOUdYJsTH
1441,Barack Obama,Time's running out—don't miss your chance to meet President Obama. http://t.co/ISoGPzOgjC http://t.co/35VNYcJ173
1442,Barack Obama,Do you hear that? It's the sound of a big fundraising deadline. Chip in now: http://t.co/P2OKsoqauD http://t.co/HwLOkj1Yu7
1443,Barack Obama,Fall is here—and so is your chance to meet President Obama. Enter now: http://t.co/n4NbQGNFEY http://t.co/WcGg9JgUtI
1444,Barack Obama,Walk the walk—support the team that's fighting for today's important issues. http://t.co/wbVIDVxuR3 http://t.co/l0L3qFHqHe
1445,Barack Obama,Climate change is an issue that cannot be left for future generations—and @pontifex agrees: http://t.co/f9HHt0iOJk #ActOnClimate
1446,Barack Obama,You could win a chance to meet President Obama. (Let that sink in.) Enter now: http://t.co/KSgSX9Q2oZ http://t.co/jmYatM9iHS
1447,Barack Obama,Don't cruise past this fundraising deadline. Chip in now: http://t.co/JJdjpc5NsC http://t.co/Hcxby32bBv
1448,Barack Obama,"With less than a week left to avert a shutdown, Congress is wasting time trying to take away women's access to health care. #EnoughAlready"
1449,Barack Obama,Change starts with people working together. Read how volunteers in Tucson are organizing to make change a reality: http://t.co/9DZsoYQhQX
1450,Barack Obama,Give your #SquadGoals an upgrade—enter now to meet President Obama: http://t.co/YciDxgp2G7 http://t.co/NTGLaTFJvi
1451,Barack Obama,17.6 million Americans covered—that's a number to celebrate: http://t.co/O9RMgldsv0 #Obamacare
1452,Barack Obama,Watch @Pontifex say why it's so important for everyone to come together to #ActOnClimate. #PopeInDC http://t.co/ouZ0PDWQKt
1453,Barack Obama,Dress to impress—you could win the chance to meet President Obama. Enter now: http://t.co/zBueGYPTHd http://t.co/fAXVkEzVqU
1454,Barack Obama,"""Michelle and I extend our wishes for an easy fast to all those observing Yom Kippur."" —President Obama"
1455,Barack Obama,LIVE: Watch as @Pontifex is welcomed to the White House. http://t.co/ZFiuZHzv1c #PopeInDC
1456,Barack Obama,Get your camera ready—this is your chance to meet President Obama. Enter now: http://t.co/0oV4SDhmTC http://t.co/RSAOEK6By5
1457,Barack Obama,LIVE: President Obama and others are greeting @Pontifex at Joint Base Andrews. http://t.co/zjsmIQ2ZBo
1458,Barack Obama,America doesn't need another shutdown—members of Congress need to do their job and pass a budget. Read more: http://t.co/f3JIAvFN4Y
1459,Barack Obama,Hope you're ready—fall is here. http://t.co/LpWzq0BmiU
1460,Barack Obama,Read how @OFA volunteers in Tucson are working hard to bring change to their community. http://t.co/oMXhaZuidu
1461,Barack Obama,Climate change is real—and it's time to act. http://t.co/bjIcRhTniI (h/t @washingtonpost) http://t.co/U9HJCLVUGt
1462,Barack Obama,"""There’s nothing principled about the idea of another government shutdown."" —President Obama http://t.co/P7dlz9Q0V9"
1463,Barack Obama,"In the weekly address, President Obama calls on Congress to stop playing games with our economy and pass a budget. http://t.co/P7dlz9yq3B"
1464,Barack Obama,LIVE: President Obama is speaking at the White House screening of @Vice's documentary on criminal justice reform. http://t.co/yeB7SdvFL4
1465,Barack Obama,"When women are empowered, extraordinary things happen. Read more: http://t.co/rJcgDBNvqY http://t.co/2y4N6lLsn3"
1466,Barack Obama,Retweet if you agree. #LeadOnLeave http://t.co/RTPz8Ni0zK
1467,Barack Obama,It's time to #LeadOnLeave—because what's good for workers and families is good for the economy: http://t.co/Venhc8up8h
1468,Barack Obama,The uninsured rate continues to fall—and that's no accident. Read about how #Obamacare is making a difference: http://t.co/eCHaWdPKam
1469,Barack Obama,"""If you're eligible, commit to becoming a citizen today."" —President Obama #ConstitutionDay"
1470,Barack Obama,Investments in clean energy are boosting the economy—while fighting climate change. #ActOnClimate http://t.co/24j5r1rmAW
1471,Barack Obama,States and cities from the U.S. and China are pledging to #ActOnClimate—years earlier than national targets. http://t.co/VCyS0feIHY
1472,Barack Obama,"Since President Obama took office, the economy has seen the longest streak of private-sector job growth on record. http://t.co/eQfj7I4Hf7"
1473,Barack Obama,Obamacare is working—and it's lowering the uninsured rate: http://t.co/ai6kVADJIN
1474,Barack Obama,"Since President Obama took office, the deficit has been reduced by more than two-thirds. http://t.co/lpOOBKxN5d"
1475,Barack Obama,LIVE: President Obama is speaking with a group of business leaders at the @BizRoundtable. http://t.co/ntXhYFIvWD
1476,Barack Obama,Listen to President Obama's advice on going to college for high school seniors—including his oldest daughter. http://t.co/SvqO4wyZiW
1477,Barack Obama,Be part of the team fighting back against misinformation with facts: http://t.co/icg1JZ1EUE http://t.co/loxbvboLwq
1478,Barack Obama,LIVE: President Obama is hosting a town hall on college access and affordability with high school students. http://t.co/b9Xi7mmcbr
1479,Barack Obama,Tune in at 4:40 p.m. ET to watch President Obama discuss college affordability with high school students in Iowa: http://t.co/D4mKdbJBIf
1480,Barack Obama,"""From my family to yours, Shanah Tovah."" —President Obama on #RoshHashanah http://t.co/O4TP1EOQfY"
1481,Barack Obama,"""Everyone should be able to find clear, reliable, open data on college affordability and value."" —President Obama http://t.co/rl0d4lYTaQ"
1482,Barack Obama,"In the weekly address, President Obama discusses another step in expanding #CollegeOpportunity. http://t.co/rl0d4mguzq"
1483,Barack Obama,"""The events of September 11, 2001, left a permanent mark on the spirit of every American."" —President Obama http://t.co/oob3Hc0vmi"
1484,Barack Obama,"""This vote is a victory for diplomacy ... and for the safety and security of the world."" —President Obama on the #IranDeal vote"
1485,Barack Obama,Retweet if you agree that education should be available to all those willing to work for it. #CollegeOpportunity http://t.co/4HyiqG46mm
1486,Barack Obama,"""I want two years of college to be as free and universal as high school is today."" —President Obama http://t.co/bCyIRfknii"
1487,Barack Obama,Progress happens when people fight for it. Join the movement—say you're in: http://t.co/SJBTJ4HLP9 http://t.co/rjGXjzlblf
1488,Barack Obama,"""I believe that working Americans should have the basic security of paid leave."" —President Obama #LeadOnLeave http://t.co/ynIFoRouyj"
1489,Barack Obama,LIVE: President Obama and @DrBiden discuss the administration's plan to expand #CollegeOpportunity. http://t.co/9dgwtJbcyp
1490,Barack Obama,Tune in at 3:40 p.m. ET to watch President Obama and @DrBiden speak in Michigan on expanding #CollegeOpportunity. http://t.co/3Y6tYK6YQH
1491,Barack Obama,Solar energy is heading toward a record-setting year for growth. Find out more: http://t.co/L72GR0YrCp
1492,Barack Obama,Get the facts on one of today's most consequential foreign policy debates: http://t.co/e5DVy50S2l #IranDeal
1493,Barack Obama,The Obama administration is pushing for paid leave and a higher minimum wage at the state and local level. http://t.co/0oW8hN3jar
