,Name,Tweet
0,Barack Obama,"Stories like this are a reminder of our duty, as a country and as Americans, to support every veteran—not only in w…"
1,Barack Obama,"This Veterans Day, here’s a moving portrait of the extraordinary resilience of my friend Cory Remsburg, an Army Ran…"
2,Barack Obama,"No one says it better than @MichelleObama — the Obama Presidential Center coming to the South Side isn't for us, it…"
3,Barack Obama,"Proud of all the Americans who showed up to vote yesterday, electing a set of hopeful, forward-thinking leaders pri…"
4,Barack Obama,Proud to endorse an outstanding group of Virginia Democrats in Tuesday’s election—candidates who’ll not only advanc…
5,Barack Obama,"Today’s the first day of open enrollment on https://t.co/ob1Ynoesod, and high-quality coverage might be more afford…"
6,Barack Obama,Congrats to the World Champion @Nationals and their fans! A great group that always showed up when it counted and w…
7,Barack Obama,Glad to be back in Chicago for the @ObamaFoundation Summit. It’s where I first learned to organize—and where I met…
8,Barack Obama,".@SamanthaJPower is a Pulitzer winner, an incredible writer, and a great friend. Her memoir, The Education of an Id…"
9,Barack Obama,"Michelle and I are heartbroken over the passing of our friend, Elijah Cummings. May his example inspire more Americ…"
10,Barack Obama,"I was proud to work with Justin Trudeau as President. He's a hard-working, effective leader who takes on big issues…"
11,Barack Obama,"In December, Michelle and I will head to Malaysia for the first @ObamaFoundation Leaders: Asia-Pacific gathering. T…"
12,Barack Obama,"Yesterday, marathoner Eliud Kipchoge became the first ever to break two hours. Today in Chicago, Brigid Kosgei set…"
13,Barack Obama,"Congrats to the @WashMystics on a gutsy, first-ever championship! A great team performance when it counted. If folk…"
14,Barack Obama,Here’s an interesting read—a reminder that behind every opinion lies a human being with real experiences and a stor…
15,Barack Obama,"As President, I leaned on @AmbassadorRice’s experience, expertise, and willingness to tell me what I needed to hear…"
16,Barack Obama,"Like the Beatles said: It’s getting better all the time. Thanks, babe, for 27 amazing years!"
17,Barack Obama,"On National Voter Registration Day, it’s up to us as citizens to make sure everyone we know can make their voices h…"
18,Barack Obama,One challenge will define the future for today’s young generation more dramatically than any other: Climate change.…
19,Barack Obama,"Just 16, @GretaThunberg is already one of our planet’s greatest advocates. Recognizing that her generation will bea…"
20,Barack Obama,That’s what Americans do when others are in need – we help. We give. We inspire. Want to make a difference? There a…
21,Barack Obama,"Jermaine Bell is just six years old, but when he saw people in need, he took the money he’d been saving for a trip…"
22,Barack Obama,Bahamian families and communities face a long recovery from Hurricane Dorian. And Americans are reaching out to hel…
23,Barack Obama,"As we remember those we lost on 9/11, we also remember the spirit of unity and togetherness that defined the weeks…"
24,Barack Obama,"Marca had a remarkable way of bringing out the best within us. For me, she was a trusted voice and a persistent, bu…"
25,Barack Obama,"Yesterday’s ruling is a big win for North Carolina—and for all of us. Voters should choose their representatives, n…"
26,Barack Obama,"Saw this story of a young person doing great work and wanted to share it—keep it up, David! That’s some creative or…"
27,Barack Obama,Training is at the heart of organizing. It’s why I’ve always made it a priority – from my 2008 campaign until now.…
28,Barack Obama,"With summer winding down, here’s a sampling of what Michelle and I have been listening to — some new, some old, som…"
29,Barack Obama,A good story gives you the chance to better understand someone else’s life. It can help you find common ground. And…
30,Barack Obama,"Toni Morrison was a national treasure, as good a storyteller, as captivating, in person as she was on the page. Her…"
31,Barack Obama,"Until all of us stand up and insist on holding public officials accountable for changing our gun laws, these traged…"
32,Barack Obama,
33,Barack Obama,"The families of our wounded warriors don't often get a lot of fanfare, but they're serving and sacrificing right al…"
34,Barack Obama,Recent court decisions make it clear that the change we need to restore our democracy has to come from the ground u…
35,Barack Obama,"Here’s a worthwhile Sunday read: “…nothing should temper partisanship more than an awareness that somewhere, on som…"
36,Barack Obama,"I’ve always been proud of what this team accomplished during my administration. But more than what we did, I’m prou…"
37,Barack Obama,Economist Raj Chetty is not only identifying the decline in opportunity we’ve seen in recent decades—but trying to…
38,Barack Obama,Here are a couple of articles backed by new research that are worth taking a look at: A new study on the Medicaid e…
39,Barack Obama,"In America, we don’t fear the future, we embrace it. 50 years ago, that spirit took us to the moon. Today, it’s emb…"
40,Barack Obama,"#MandelaDay reminds us that when things feel dark, confusing, or impossible—take a look back at his writings. There…"
41,Barack Obama,I have a good feeling about these Chicago @UrbanAlliance interns. Thanks for letting me spend yesterday afternoon w…
42,Barack Obama,"The @ObamaFoundation is helping a new generation of leaders make their mark, and there’s an extraordinary group gat…"
43,Barack Obama,Proud to rep America’s best team! Congrats @USWNT and thanks for being such a strong inspiration for women and girl…
44,Barack Obama,"Yes! Fourth star. Back to back. Congrats to the record breakers on the @USWNT, an incredible team that’s always pus…"
45,Barack Obama,"Happy Fourth of July, everybody! This is always a great day in the Obama family: a chance to celebrate America—and…"
46,Barack Obama,"I’m admittedly biased, but this article gibes with my experience about what all of us might take away from the “alo…"
47,Barack Obama,Congrats to the USWNT! A great performance from a great team—looking forward to Sunday. #OneNationOneTeam
48,Barack Obama,No one changes the world alone. That’s why the @ObamaFoundation is connecting emerging leaders from South Africa to…
49,Barack Obama,The most important job in our democracy is citizen. If you’re tired of politicians manipulating maps and ignoring t…
50,Barack Obama,"50 years ago, history was written at the Stonewall Inn when New York's LGBT community stood up, spoke out, and star…"
51,Barack Obama,What a gift to come across this interview with Julia “Hurricane” Hawkins. I’m as grateful for her life advice as I…
52,Barack Obama,"Now we’re talking! Congrats to Team USA for moving on, and thanks for continuing to make us all proud. #USA"
53,Barack Obama,"On Juneteenth, we celebrate our capacity to make real the promise of our founding, that thing inside each of us tha…"
54,Barack Obama,"Outside the Oval Office, I kept a painting of a small crowd huddled around a pocketwatch, waiting for the moment th…"
55,Barack Obama,This is worth a read: a thought-provoking reminder that education reform isn’t a cure-all. As a supporter of educat…
56,Barack Obama,"Yes we can, Greta. I’m hopeful because of you and all the young people who are fighting to protect the planet. Keep…"
57,Barack Obama,"Happy Father’s Day to Charles, one of our @ObamaFoundation Fellows, and all the dads at Fathers’ Uplift. Today, we’…"
58,Barack Obama,The @USWNT is something to smile about. It was great to celebrate with them back in 2015 and I'm excited to root th…
59,Barack Obama,"Six years ago, David Ortiz's spirit and resolve helped us all begin to heal from the Boston Marathon bombing. Today…"
60,Barack Obama,"Last week, it was Virginia Beach. But day after day and year after year, too many families and communities are shat…"
61,Barack Obama,"You've got a lot to be proud of, Jiwandeep. Thanks for everything you do to make this country a little more equal.…"
62,Barack Obama,What a life. American history has always been driven by visionaries like Leah Chase—and all the men and women who w…
63,Barack Obama,"A story worth sharing: Twelve years ago, Brian joined my first presidential campaign. Two years ago, he was diagnos…"
64,Barack Obama,Exciting to see the faces of Colombia's future at an @ObamaFoundation roundtable with young leaders in Bogotá. Thei…
65,Barack Obama,"On Memorial Day, we remember all those who gave everything for something greater than themselves. It's up to us to…"
66,Barack Obama,Great to get out there and take a few cuts at the plate yesterday—I had a blast with all these extraordinary young…
67,Barack Obama,"Here’s a great story: While we’ve still got a lot of work to do to make college affordable for everyone, that didn’…"
68,Barack Obama,"Happy Mother's Day to the most caring, brilliant, funny, and grounded woman I know—a perfect role model not just fo…"
69,Barack Obama,"As part of the @ObamaFoundation, moms like Dr. Mwansa Ketty Lubeya are answering the call for change—and raising th…"
70,Barack Obama,"Happy #CollegeSigningDay, everybody! I'm proud of every student out there who's taking the next step in their educa…"
71,Barack Obama,"Condolences to the family of John Singleton. His seminal work, Boyz n the Hood, remains one of the most searing, lo…"
72,Barack Obama,Congratulations to the new class of @ObamaFoundation Fellows! Their work in every region of the globe is already ma…
73,Barack Obama,"For thirty-six years, Richard Lugar proved that pragmatism and decency work—not only in Washington but all over the…"
74,Barack Obama,Dominique’s story is a reminder to us that where you’re from shouldn’t define what you can achieve. I’m proud of he…
75,Barack Obama,"This generation of climate activists is tired of inaction, and they've caught the attention of leaders all over the…"
76,Barack Obama,"And in the U.S., 13-year old @AlexandriaV2005 of New York, 13-year old @havenruthie of Denver, and 16-year old…"
77,Barack Obama,"I met 23-year-old @luisamneubauer in Berlin earlier this month. Luisa, the organizer behind the student movement in…"
78,Barack Obama,"They're people like 16-year-old @GretaThunberg, whose protests at Swedish parliament sparked a movement. Inspired b…"
79,Barack Obama,Young people all over the world are leading the way in the fight to protect our planet because they know their futu…
80,Barack Obama,"To all who celebrate today, happy Easter from our family to yours! On this day of rebirth and renewal, let’s recomm…"
81,Barack Obama,"The attacks on tourists and Easter worshippers in Sri Lanka are an attack on humanity. On a day devoted to love, re…"
82,Barack Obama,"Notre Dame is one of the world’s great treasures, and we’re thinking of the people of France in your time of grief.…"
83,Barack Obama,"Congratulations, Tiger! To come back and win the Masters after all the highs and lows is a testament to excellence, grit, and determination."
84,Barack Obama,"Another good story worth sharing: From one ""kid from Akron"" to a new generation of Akron kids, some remarkable earl…"
85,Barack Obama,"From a big NBA fan, congrats to future Hall of Famers Dwyane Wade and Dirk Nowitzki—not just all-time greats but class acts, too."
86,Barack Obama,"In just a few minutes, I’m taking the stage at the @ObamaFoundation Town Hall Europe for a conversation about how t…"
87,Barack Obama,A voice everybody should hear.
88,Barack Obama,Here’s a story about people doing good that's worth sharing: @BradPaisley and his wife @Kimwilliamspais saw food in…
89,Barack Obama,"Great to see Chicago’s historic mayoral race between two highly qualified candidates. Congrats to our next mayor, L…"
90,Barack Obama,Valerie is one of my oldest friends and advisors – she was by my side when I first decided to run for office and fo…
91,Barack Obama,"Last night I had the chance to meet with first-term Democrats in Congress—it's a young, diverse class, stocked with…"
92,Barack Obama,"Just in the nick of time: My brackets have never been my one shining moment, but here we go again. You can check ou…"
93,Barack Obama,"And here are some ways to help cyclone victims in Mozambique, Malawi, and Zimbabwe:"
94,Barack Obama,The floods in the Midwest and in southern Africa are heartbreaking. Suffering and loss on two sides of the world ca…
95,Barack Obama,"In 2011, I visited the tiny town of Moneygall and got to walk around in the house where my great-great-great grandf…"
96,Barack Obama,Michelle and I send our condolences to the people of New Zealand. We grieve with you and the Muslim community. All…
97,Barack Obama,.@MichelleObama and I are rooting hard for Team USA as the Special Olympics World Games get underway this week. Our…
98,Barack Obama,"What a great moment. Happy 110th, Virginia."
99,Barack Obama,Michelle and I send our deepest sympathies to all who knew the victims of today’s plane crash in Ethiopia.
100,Barack Obama,The Crew Dragon’s been on quite a ride since I last saw it—congrats to @NASA and @SpaceX on a successful return! We…
101,Barack Obama,"Preethi, Alice, and Sefora are just three of many @ObamaFoundation leaders who remind us what International Women’s…"
102,Barack Obama,And @SeforaKodjo is helping the next generation of women leaders in Africa rise up. Her organization is training an…
103,Barack Obama,".@BarbeAlice is helping refugees resettle into welcoming communities in France, offering them job training and lang…"
104,Barack Obama,.@preethiherman is helping women unleash their power to change their societies. As head of the…
105,Barack Obama,"On International Women’s Day, I’m reflecting on the future we all want for our daughters: one where they can live o…"
106,Barack Obama,It’s up to all of us as citizens to make sure that the rules of democracy are fair—everywhere—because the next deca…
107,Barack Obama,Zion Williamson seems like an outstanding young man as well as an outstanding basketball player. Wishing him a speedy recovery.
108,Barack Obama,I’m about to join @StephenCurry30 on stage with @MBK_Alliance to answer questions from boys and young men of color…
109,Barack Obama,I’ve always loved basketball because it’s about building a team that’s equal to more than the sum of its parts. Gla…
110,Barack Obama,"Happy Valentine’s Day to the extraordinarily smart, beautiful, funny, one and only @MichelleObama. It’s true; she d…"
111,Barack Obama,"In the year since their friends were killed, the students of Parkland refused to settle for the way things are and…"
112,Barack Obama,"Don’t be sad it’s over, be proud it taught us so much. Congrats to all the men and women of @NASA on a @MarsRovers…"
113,Barack Obama,"Happy 85th birthday to @RealBillRussell - the greatest champion in American sports, and a lifelong warrior for justice."
114,Barack Obama,My statement on the passing of former Congressman John Dingell:
115,Barack Obama,We lost two great Americans today – Frank Robinson and John Dingell – citizens who inspired me and so many others b…
116,Barack Obama,"As we celebrate Black History Month and Jackie Robinson’s 100th birthday, we celebrate the life of all whose courag…"
117,Barack Obama,The @ObamaFoundation is connecting people from around the world so they can form partnerships just like this. I am…
118,Barack Obama,"I’ve always drawn inspiration from what Dr. King called life’s most persistent and urgent question: ""What are you d…"
119,Barack Obama,"I knew it way back then and I’m absolutely convinced of it today — you’re one of a kind, @MichelleObama. Happy Birt…"
120,Barack Obama,"In 2018 people stepped up and showed up like never before. Keep it up in 2019. We’ve got a lot of work to do, and I…"
121,Barack Obama,"I hope you find inspiration in the stories of Dejah, Moussa, Sandor, Hong and Jonny. Their journeys began with a de…"
122,Barack Obama,"Leaders like Jonny Boucher, a Chicago native who, after losing too many friends and family to suicide, started a co…"
123,Barack Obama,"Leaders like Hong Hoang, who mobilized a youth-led movement to create a greener world after becoming the first Viet…"
124,Barack Obama,"Leaders like Moussa Kondo and Sandor Lederer, who are each doing their part to fight corruption in their native cou…"
125,Barack Obama,"Leaders like Dejah Powell, who started an organization to bring health and wellness resources to communities on the…"
126,Barack Obama,"As the year winds down and we look toward 2019, I’m asking you to make a commitment: find something you want to cha…"
127,Barack Obama,"As 2018 draws to a close, I’m continuing the tradition of sharing my year-end lists. It gives me a moment to reflec…"
128,Barack Obama,Enjoy the holiday season with the ones you love. Michelle and I wish you a very Merry Christmas!
129,Barack Obama,There’s no better time than the holidays to give back to your community. Yesterday I got to do just that at…
130,Barack Obama,"Merry Christmas and happy holidays to the extraordinary kids, families, and staff at Children’s National. And thank…"
131,Barack Obama,Today is the last day of open enrollment. That means it’s the deadline to make sure you and the people you love hav…
132,Barack Obama,"Joe is right. Head to https://t.co/SS87NTsgJt before tomorrow’s deadline. And nice bracelet, by the way."
133,Barack Obama,"As Bobby Kennedy taught us, the thing about hope is that it travels through space *and* time, first splashing again…"
134,Barack Obama,No jump shots. No ferns. No memes. Not this time. I’m going to give it to you straight: If you need health insuranc…
135,Barack Obama,"Happy Hanukkah! Over these eight nights, we draw inspiration from light that can overpower any darkness, and recomm…"
136,Barack Obama,"America has lost a patriot and humble servant in George Herbert Walker Bush. While our hearts are heavy today, they…"
137,Barack Obama,"I am grateful for the next generation of leaders -- the young people who are tolerant, creative, idealistic and doi…"
138,Barack Obama,Thanks to the Chicago @FoodDepository team for all you do and to the volunteers who are doing great work and let me…
139,Barack Obama,"When someone shares their story, we see the world through their eyes. I’m looking forward to hearing a few from lea…"
140,Barack Obama,"Our future depends on all our young people, including our boys and young men of color, being able to achieve their…"
141,Barack Obama,"Of course, @MichelleObama’s my wife, so I’m a little biased here. But she also happens to be brilliant, funny, wise…"
142,Barack Obama,"Michelle and I are heartbroken for everybody who’s lost so much in California, and grateful for the heroism of the…"
143,Barack Obama,To all our veterans and your families: thank you. There's no tribute that can truly match the magnitude of your ser…
144,Barack Obama,Congratulations to everybody who showed up and participated in our democracy in record numbers yesterday. The chang…
145,Barack Obama,"Today is the day. Today, it’s your turn to raise your voice to change the course of this country for the better. So…"
146,Barack Obama,"If you take that power and vote, something powerful happens. Change happens. Hope happens. And with each new step w…"
147,Barack Obama,"When you vote, you have the power to make it easier for a student to afford college, and harder for a disturbed per…"
148,Barack Obama,"When you vote, you have the power to protect voting rights. To make sure our criminal justice system treats everyon…"
149,Barack Obama,"When we've been at such crossroads before, Americans have made the right choice. Not because we sat back and waited…"
150,Barack Obama,Tomorrow’s elections might be the most important of our lifetimes. The health care of millions is on the ballot. Ma…
151,Barack Obama,"Speaking of preexisting conditions, open enrollment starts today. If you or someone you know needs health care, vis…"
152,Barack Obama,"Elections matter. You have the power to protect a family’s health care. Make a plan, grab some friends, and vote:"
153,Barack Obama,"While we're talking about preexisting conditions, the ACA is the law that finally protected your coverage for preex…"
154,Barack Obama,"Not sure who and what you can vote for? Head over to https://t.co/SHxg6ael0O to look up your state, learn who's run…"
155,Barack Obama,Your vote can decide the health care of millions. Your voice can determine the character of our country. You have p…
156,Barack Obama,We grieve for the Americans murdered in Pittsburgh. All of us have to fight the rise of anti-Semitism and hateful r…
157,Barack Obama,"The last presidential election turned on fewer than 100,000 votes in three states. More people go to Coachella. The…"
158,Barack Obama,America is always at our best when we look out for each other. Please do what you can to help people recover and re…
159,Barack Obama,I’m so proud of the work @MichelleObama has done over the years to ensure adolescent girls have access to education…
160,Barack Obama,Congratulations to Drew Brees on the all time passing record. Always a class act.
161,Barack Obama,"Happy Anniversary, @MichelleObama. For 26 years, you’ve been an extraordinary partner, someone who can always make…"
162,Barack Obama,"Today, I’m proud to endorse even more Democratic candidates who aren’t just running against something, but for some…"
163,Barack Obama,"From civil servants to organizers, the young people I met in Amsterdam today are doing the hard work of change. And…"
164,Barack Obama,"The antidote to government by a powerful few is government by the organized, energized many. This National Voter Re…"
165,Barack Obama,"The first class of Obama Fellows is full of leaders like Keith—hardworking, innovative, and dedicated to partnering…"
166,Barack Obama,"We will always remember everyone we lost on 9/11, thank the first responders who keep us safe, and honor all who de…"
167,Barack Obama,Today I’m at the University of Illinois to deliver a simple message to young people all over the country: You need…
168,Barack Obama,Yesterday I met with high school students on Chicago’s Southwest side who spent the summer learning to code some pr…
169,Barack Obama,Congratulations to Hawaii for winning the Little League World Series! You make America very proud. 🤙🏾
170,Barack Obama,Our statement on the passing of Senator John McCain:
171,Barack Obama,"Aretha helped define the American experience. In her voice, we could feel our history, all of it and in every shade…"
172,Barack Obama,"Bobby Kennedy was one of my heroes. He was someone who showed us the power of acting on our ideals, the idea that a…"
173,Barack Obama,"I’m confident that, together, they’ll strengthen this country we love by restoring opportunity, repairing our allia…"
174,Barack Obama,"Today I’m proud to endorse such a wide and impressive array of Democratic candidates – leaders as diverse, patrioti…"
175,Barack Obama,"Mandela Day is about taking action to change the world for the better. In these young people, I see Madiba's exampl…"
176,Barack Obama,"This week, I’m traveling to Africa for the first time since I left office – a continent of wonderful diversity, thr…"
177,Barack Obama,Congratulations to the @Capitals! This @NHLBlackhawks fan knows what it’s like to lift that cup – and I’m happy for…
178,Barack Obama,"“Low plastic stool, cheap but delicious noodles, cold Hanoi beer.” This is how I’ll remember Tony. He taught us abo…"
179,Barack Obama,"This National Gun Violence Awareness Day, show your commitment to keeping our kids safe from gun violence. Then, fo…"
180,Barack Obama,"We can never truly repay the debt we owe our fallen heroes. But we can remember them, honor their sacrifice, and af…"
181,Barack Obama,This Center is for the leaders of tomorrow who are ready to step up and build the world as it should be. Michelle a…
182,Barack Obama,"Happy Mother’s Day to every mom out there, especially the remarkable moms in my life, @MichelleObama and my mother-…"
183,Barack Obama,There are few issues more important to the security of the US than the potential spread of nuclear weapons or the p…
184,Barack Obama,"These talented young people will create a better future not just in Africa, but around the world. I can’t wait to s…"
185,Barack Obama,Our statement on the passing of Former First Lady Barbara Bush:
186,Barack Obama,Incredible to have a Chicago team in the Final Four. I’ll take that over an intact bracket any day! Congratulations…
187,Barack Obama,Michelle and I are so inspired by all the young people who made today’s marches happen. Keep at it. You’re leading…
188,Barack Obama,Our most important task as a nation is to make sure all our young people can achieve their dreams. We’ve started th…
189,Barack Obama,"In Singapore with young people who are advocating for education, empowering young women, and getting involved all o…"
190,Barack Obama,41: I like the competition. And the loyalty to the home team. - 44
191,Barack Obama,Congrats to @LoyolaChicago and Sister Jean for a last-second upset - I had faith in my pick!
192,Barack Obama,"Just because I have more time to watch games doesn’t mean my picks will be better, but here are my brackets this ye…"
